id,title,link
8416,Respect Hawk (Lupin III),https://redd.it/f8lg8m
8417,Respect Claude von Riegan (Fire Emblem: Three Houses),https://redd.it/f8tuix
8418,Respect Basque Grand (Fullmetal Alchemist composite),https://redd.it/f8vmxq
8419,Respect Jesse Faden (Control),https://redd.it/f8x3mb
8420,Respect Kozuki Oden! (One Piece),https://redd.it/f92j5k
8421,Respect Wolf (Aliens vs. Predator: Requiem),https://redd.it/f93e0a
8422,Respect Guzma (Pokemon Anime),https://redd.it/f94lgn
8423,Respect Tierno (Pokemon Anime),https://redd.it/fccuhd
8424,"Respect Alexi Shostakov (Marvel, 616)",https://redd.it/f9alwp
8425,Respect Presea Combatir (Tales of Symphonia: The Animation),https://redd.it/f9fwz4
8426,Respect Yggdrasill (Tales of Symphonia: The Animation),https://redd.it/f9z7ww
8427,Respect the Silver Surfer (Fantastic Four: Rise of the Silver Surfer) (Earth-121698) (Marvel Comics),https://redd.it/fa195c
8428,Respect Ichigo Kurosaki (Bleach: Hell Verse),https://redd.it/fbwltr
8429,"Respect Robert `"Bob`" Richards! (Tekken)",https://redd.it/f9jokg
8430,Respect Gon (Origin),https://redd.it/f9n7g0
8431,Respect Fall Barros (Sword Interval),https://redd.it/f9v7s2
8432,Respect Reginald / Reggie (Sword Interval),https://redd.it/fa1euv
8433,Respect Alexandra Ivanova (Sword Interval),https://redd.it/fa27nj
8434,Respect Marco Tousi / The Red Rover (Sword Interval),https://redd.it/fa29nk
8435,Respect Mah Yun / The Stygian Medusa (Sword Interval),https://redd.it/fa2ax5
8436,Respect the Carnelian Raven (Sword Interval),https://redd.it/fa2bsc
8437,Respect the Ivory Stalker (Sword Interval),https://redd.it/fa2dgi
8438,Respect the Plutonian Flame (Sword Interval),https://redd.it/fa2e12
8439,Respect Warlord Ranveig's Superweapon! (Voltron: Legendary Defender),https://redd.it/fa2553
8440,Respect Lord Voldemort (Harry Potter (Films)),https://redd.it/f9xvm9
8441,Respect Albus Dumbledore (Harry Potter (Films)),https://redd.it/f9y0zg
8442,Respect Ash Ketchum (Pokemon: The Electric Tale of Pikachu),https://redd.it/fa34vz
8443,Respect Avatar Roku (Avatar: The Last Airbender),https://redd.it/fa5m2z
8444,"Respect The Seven! (The Boys, Dynamite Entertainment)",https://redd.it/fa569a
8445,"Respect Homelander! (The Boys, Dynamite)",https://redd.it/d2ib3k
8446,Respect Saito Hajime (Rurouni Kenshin),https://redd.it/fafbj8
8447,Respect Jr. Troopa (Paper Mario),https://redd.it/fai9uw
8448,Respect Tama Inubozaki! (Magical Girl Raising Project),https://redd.it/fbpqtv
8449,Respect Ezekial 'Zeke' Stane (Earth-616) (Marvel Comics),https://redd.it/fbt40s
8450,Respect Togata (Fire Punch),https://redd.it/fbtxxa
8451,Respect Sakura (Pokemon Anime),https://redd.it/fbuej8
8452,Respect Gan (The Dark Tower),https://redd.it/fbqpa9
8453,Respect Erin Harson (You're Next),https://redd.it/fau8or
8454,Respect Kitana! (Mortal Kombat: Shaolin Monks),https://redd.it/fayvm2
8455,Respect Kitana! (Malibu Comics' Mortal Kombat),https://redd.it/faz0o0
8456,Respect Kitana! (Mortal Kombat: Conquest),https://redd.it/faz6hu
8457,Respect Kitana! (Mortal Kombat: Legacy),https://redd.it/fazbke
16061,Respect Dust (Bunnykill),https://redd.it/m68wyq
16062,Respect the Smart House (Smart House),https://redd.it/m6g7e8
8458,"Respect Guardian (Clone) (DC, Post Crisis)",https://redd.it/fbfy24
8459,Respect James Bond Jr (James Bond Jr),https://redd.it/fb6ldr
8460,Respect Vale and Timor (No One Left To Fight),https://redd.it/fbj6v6
8461,Respect Cheetu! (Hunter X Hunter),https://redd.it/fbykyc
8462,Respect Skipper! (Madagascar),https://redd.it/f91wlm
8463,Respect Kowalski! (Madagascar),https://redd.it/f91xss
8464,Respect Rico! (Madagascar),https://redd.it/f91y66
8465,Respect Private! (Madagascar),https://redd.it/f91ybc
16063,Respect the Aliens (Mac and Me),https://redd.it/m72rwa
16064,Respect the Walrider (Outlast),https://redd.it/m730vj
16065,Respect Straightman (Batman: The Adventures Continue),https://redd.it/m7bihr
16066,Respect Deathstroke (Batman: The Adventures Continue),https://redd.it/m7bja2
16067,Respect Azrael (Batman: The Adventures Continue),https://redd.it/m7bjxv
16068,"Respect Jason Todd, The Red Hood (Batman: The Adventures Continue)",https://redd.it/m7bkem
16069,Respect Mulan (Mulan 2020 Film),https://redd.it/m7h24d
16070,Respect Deathstroke (Lois & Clark: The New Adventures of Superman),https://redd.it/m842cc
20254,Respect Thomas Edison! (Fate),https://redd.it/p4c5bg
20255,Respect Fionn mac Cumhaill! (Fate),https://redd.it/p3ajx2
20256,Respect Nikola Tesla! (Fate),https://redd.it/p1s3ii
20257,"Respect James Moriarty, the Napoleon of Crime! (Fate)",https://redd.it/owvu8x
20258,Respect Waver Velvet/Lord El-Melloi II! (Fate),https://redd.it/ovk3fd
20259,"Respect Gray, the Gravekeeper! (Fate)",https://redd.it/ouybqj
20260,"Respect Ishtar, Queen of the Heavens! (Fate)",https://redd.it/oubxkr
20261,"Respect Hessian Lobo, the Avenger of Shinjuku! (Fate)",https://redd.it/oucwpc
20262,"Respect Saint Martha, the Dragonslayer! (Fate)",https://redd.it/ouenpd
20263,Respect Titan (Invincible),https://redd.it/ouebxj
20264,Respect Ben Tennyson (Cartoon Network Action Packs),https://redd.it/q1809y
20265,Respect Charmcaster! (Ben 10 Classic),https://redd.it/pmckae
20266,Respect Grandpa Max! (Ben 10 Classic),https://redd.it/plomja
20267,Respect Albedo! (Ben 10 Classic),https://redd.it/pl05zb
20268,Respect Gwen Tennyson (Ben 10 Classic),https://redd.it/pf6tp6
20269,Respect Gwen 10 (Ben 10),https://redd.it/pmw7vu
20270,"Respect Gwen Tennyson (Ben 10, Gweniverse)",https://redd.it/pmw808
20271,Respect Michael Morningstar (Ben 10 Classic),https://redd.it/pmwtyr
20272,Respect Rook Blonko! (Ben 10 Classic),https://redd.it/pkdzjj
20273,Respect Upchuck! (Ben 10 Classic),https://redd.it/petm2l
20274,Respect Jetray! (Ben 10 Classic),https://redd.it/peliub
20275,Respect Chromastone! (Ben 10 Classic),https://redd.it/pdapts
20276,Respect Spidermonkey! (Ben 10 Classic),https://redd.it/pdw706
20277,Respect Swampfire! (Ben 10 Classic),https://redd.it/pculwd
20278,Respect Water Hazard (Ben 10 Classic),https://redd.it/pdbsx2
20279,Respect Kevin Levin! (Ben 10 Classic),https://redd.it/pdejw6
20280,Respect Lodestar (Ben 10 Classic),https://redd.it/p3nk1j
20281,Respect Goop! (Ben 10 Classic),https://redd.it/pd15vt
20282,Respect George Washington (Ben 10),https://redd.it/oxshmq
20283,Respect Feedback (Ben 10),https://redd.it/p1q3hu
20284,Respect Aggregor! (Ben 10),https://redd.it/owpl0t
20285,Respect Terraspin (Ben 10),https://redd.it/owjw9j
20286,Respect Crashhopper (Ben 10),https://redd.it/ovszhz
20287,Respect Armodrillo! (Ben 10),https://redd.it/ovh7go
20288,Respect Ampfibian! (Ben 10),https://redd.it/ov9ci2
20289,Respect Gravattack (Ben 10),https://redd.it/ov67g0
20290,Respect Eatle (Ben 10),https://redd.it/ouj74n
20291,Respect Tetrax! (Ben 10 Classic),https://redd.it/oupbx1
20292,"Respect Anthony Fremont! (It's a Good Life, original short story)",https://redd.it/qd2rt8
20293,Respect Tori Rivers (Dreamwalker),https://redd.it/qc55zt
20294,Respect Life (Dreamwalker),https://redd.it/pkbbpm
20295,Respect Marrow (Dreamwalker),https://redd.it/oum2xl
20296,Respect Ryo Ogami/Kamen Rider Buster (Kamen Rider Saber)!,https://redd.it/qksfq0
20297,"Respect Mitsuzane Kureshima, Kamen Rider Ryugen (Kamen Rider Gaim)",https://redd.it/plibqu
20298,Respect Leo/Kamen Rider Psyga (Kamen Rider Faiz)!,https://redd.it/p6hlzb
20299,"Respect Kaito Kumon, Kamen Rider Baron (Kamen Rider Gaim)",https://redd.it/pk9110
20300,Respect Yuji Kiba/The Horse Orphnoch (Kamen Rider Faiz)!,https://redd.it/p6hkyy
20301,Respect Kamen Rider Delta (Kamen Rider Faiz)!,https://redd.it/p6hgwq
20302,Respect Masato Kusaka/Kamen Rider Kaixa (Kamen Rider Faiz)!,https://redd.it/p6hdp0
20303,"Respect Takumi Inui, aka (Kamen Rider Faiz)!",https://redd.it/p4dgq9
20304,"Respect Ryusei Sakuta, Kamen Rider Meteor (Kamen Rider Fourze)",https://redd.it/owev3h
20305,"Respect Gentaro Kisaragi, Kamen Rider Fourze (Kamen Rider Fourze)",https://redd.it/ovq7ar
20306,"Respect Mitsuaki Gamou, the Sagittarius Zodiarts (Kamen Rider Fourze)",https://redd.it/oxbvq8
20307,"Respect Kou Tatsugami, the Leo Zodiarts (Kamen Rider Fourze)",https://redd.it/ox2eff
20308,"Respect Natsuji Kijima, the Pegasus / Cancer Zodiarts (Kamen Rider Fourze)",https://redd.it/ov9v74
20309,Respect Agito (Origin: Spirits of the Past),https://redd.it/ove3kp
20310,Respect Flamie Speeddraw! (Rokka no Yuusha) (anime),https://redd.it/ovmpol
20311,Respect Nachetanya Loei Piena Augustra! (Rokka no Yuusha) (anime),https://redd.it/ovmsa4
20312,Respect Goldov Auora! (Rokka no Yuusha) (anime),https://redd.it/ovmslx
20313,Respect Chamot Rosso! (Rokka no Yuusha) (anime),https://redd.it/ovmsxw
20314,Respect Hans Humpty! (Rokka no Yuusha) (anime),https://redd.it/ovmtcb
3329,Respect Brandish µ! (Fairy Tail),https://redd.it/fcxb40
3987,Respect Silver Karasu (Ninja Slayer),https://redd.it/ffj0y5
640,Respect Azula (Avatar: The Last Airbender),https://redd.it/fhgdgg
876,Respect Rick Sanchez (Rick and Morty),https://redd.it/fi0cpu
5326,Respect Reaper! (Overwatch),https://redd.it/fi2m08
8528,Respect Varvara/Yomyael (Mignolaverse),https://redd.it/d5sdn7
8529,Respect Slushy/Experiment 523 (Lilo and Stitch),https://redd.it/fibjva
8530,Respect Space Racer (Invincible),https://redd.it/d2klnt
8531,Respect: Sanguinius (Warhammer 40k),https://redd.it/fh9lc0
8532,Respect The Rock (TF2 SFM),https://redd.it/fgsqes
8533,Respect Ren (Star Wars Canon),https://redd.it/fh0cci
8534,Respect Claw the Unconquered (DC Comics),https://redd.it/fh3eef
8535,Respect Garrus Vakarian (Mass Effect),https://redd.it/ffvlrj
8536,Respect James Vega (Mass Effect),https://redd.it/fgyh93
8537,Respect Tali'Zorah Vas Normandy (Mass Effect),https://redd.it/fgdtud
8538,[Respect] Godzilla (Godzilla: The Half-Century War),https://redd.it/cv6x7y
8539,Respect Zilla! (Godzilla: Rulers of Earth),https://redd.it/d1zpp4
8540,Respect the Cave-Troll (Peter Jackson's The Lord of the Rings),https://redd.it/fg09yi
8541,Respect Nermal (Garfield comic strips),https://redd.it/d28mkm
8542,"Respect Red Racer (DC, Earth 36)",https://redd.it/csu0ww
8543,Respect Rez! (Gex),https://redd.it/ffi6rn
8544,Respect Superdemon (DC Comics) [Earth 13],https://redd.it/ct302w
8545,Respect David Shimizu (Sword Interval),https://redd.it/ffj43m
8546,Respect Hato Higashikata (Jojo's Bizarre Adventure),https://redd.it/ffjsij
8547,Respect Mario (The Super Mario Bros. Super show!) [Cartoon segments],https://redd.it/fftgso
8548,Respect Thunderer (DC Comics) [Earth 7],https://redd.it/ct3ypq
8549,Respect Googam son of Goom (Marvel 616),https://redd.it/fcl9zg
8550,Respect Marrina Smallwood! (Marvel: 616),https://redd.it/fdem0r
8551,[Respect] Megaman (Marvel),https://redd.it/fhzcsp
8552,"[Respect] Fusion, the Twin Terror (Marvel) (Earth-616)",https://redd.it/fhmqta
8553,Respect Jimmy Bones (Bones),https://redd.it/fcmml8
8554,Respect En Sabah Nur (X-Men: Apocalypse),https://redd.it/fhoo50
8555,Respect Kei Kurono (Gantz Manga),https://redd.it/fhrklf
8556,Respect Justice [Afro Samurai],https://redd.it/fcmojk
8557,Respect Mudsdale (Pokemon Anime),https://redd.it/fcumav
8558,[Respect] Hulk (Earth-2301) (Mangaverse),https://redd.it/fdbgz2
8559,Respect Jet and the Freedom Fighters (Avatar: The Last Airbender),https://redd.it/fde4zd
8560,Respect Mai (Avatar: The Last Airbender),https://redd.it/fgeg1u
8561,Respect Appa (Avatar: The Last Airbender),https://redd.it/fecgfn
8562,Respect Bemular (ULTRAMAN Manga),https://redd.it/fdm8uz
8563,Respect Thaddeus Sivana (DC Extended Universe),https://redd.it/fduk5q
8564,Respect Inklings (Splatoon),https://redd.it/fdvy60
8565,Respect Miranda Lawson (Mass Effect),https://redd.it/fdwvgx
8566,Respect Bast! (The Kane Chronicles),https://redd.it/fdybjm
8567,Respect Zia Rashid! (The Kane Chronicles),https://redd.it/fh5kzt
8568,Respect Bes! (The Kane Chronicles),https://redd.it/fgg63k
8569,Respect Set! (The Kane Chronicles),https://redd.it/fejugu
8570,Respect Tyson (Heroes of Olympus),https://redd.it/fggs07
8571,Respect Jake Rivers! (Trigger Warning),https://redd.it/fgjffe
8572,[Respect] The Thing (Fred and Barney Meet the Thing) (Earth-700974),https://redd.it/fetegc
8573,Respect The Fantastic Four (Fantastic Four 2005/2007 Movies),https://redd.it/fedk6b
8574,Respect Paul Blart! (Paul Blart: Mall Cop),https://redd.it/fewtnf
8575,Respect Angel (X-Men: Apocalypse),https://redd.it/fezksk
8576,Respect Funny Trick (Magical Girl Raising Project),https://redd.it/ff0wtx
8577,Respect Chaos! (Sonic the Hedgehog),https://redd.it/ff1szy
8578,Respect Smoke! (Malibu Comics' Mortal Kombat),https://redd.it/ff3jxl
8579,Respect Smoke! (Mortal Kombat: Defenders of the Realm),https://redd.it/ff3oxl
8580,Respect Smoke! (Mortal Kombat Movie Series),https://redd.it/ff3u78
8581,Respect Gex the Gecko! (Gex),https://redd.it/ff4mbv
8582,Respect Nate Willner (Voracious),https://redd.it/ff7i51
8583,Respect Yukishiro Enishi (Rurouni Kenshin),https://redd.it/ffdzvp
8584,Respect Suki and the Kyoshi Warriors (Avatar: The Last Airbender),https://redd.it/ffe88f
20315,Respect Maura Chester! (Rokka no Yuusha) (anime),https://redd.it/ovmtke
20316,Respect Superman! (Superman: Brainiac Attacks),https://redd.it/ozq5wz
20317,Respect Brainiac (Superman: Brainiac Attacks),https://redd.it/ovpr9w
20318,Respect Blinx (Blinx: The Time Sweeper),https://redd.it/ovrotg
20319,Respect Siegfried (The Nibelungenlied),https://redd.it/ovsh75
16085,Respect Hakuhei Sabi (Katanagatari anime),https://redd.it/mh0ekr
16086,Respect Houou Maniwa (Katanagatari anime),https://redd.it/mj1fl7
16087,Respect Shichika Yasuri (Katanagatari anime),https://redd.it/ml4g0d
16088,Respect the Hollow Knight! (Hollow Knight),https://redd.it/mny7n9
16089,Respect Elijah Bradley 'Patriot' (Marvel 616),https://redd.it/mqzwxw
20320,Respect Tommy Oliver (Bat in the Sun),https://redd.it/ovtdbn
20321,Respect the Sixth Brother (Star Wars Canon),https://redd.it/qha1qt
20322,Respect Zeb Orrelios (Star Wars Canon),https://redd.it/pey81q
20323,Respect Quinlan Vos (Star Wars) [Legends],https://redd.it/ovyuxg
20324,Respect Mech Cadet Yu and Buddy (Mech Cadet Yu),https://redd.it/owfsal
20325,"Respect Batman, The Broken (DC Dark Multiverse)",https://redd.it/qjnzi7
5890,Respect Waxillium Ladrian (Mistborn),https://redd.it/fiixy8
3940,Respect Momo Yaoyorozu! (My Hero Academia),https://redd.it/fk7oae
3937,Respect Ida Tenya! (My Hero Academia),https://redd.it/fk7ok0
3939,Respect Ochako Uraraka! (My Hero Academia),https://redd.it/fk7pi6
3934,Respect Shoto Todoroki! (My Hero Academia),https://redd.it/fkpp59
8597,Respect Knuckleduster! (My Hero Academia Vigilantes),https://redd.it/fj98nz
8598,Respect Bor Búrison (Marvel 616),https://redd.it/d5dz1v
8599,Respect Hela (Marvel 616),https://redd.it/d84ucp
8600,Respect Hong Meiling (Touhou),https://redd.it/fjk8wc
8601,Respect Robin (Batmanga),https://redd.it/fjc7pj
8602,Respect Batman (Batmanga),https://redd.it/fjc8v9
8603,Respect Javik (Mass Effect),https://redd.it/fih9zr
8604,Respect Thalia Grace (Heroes of Olympus),https://redd.it/fiip7t
8605,Respect Cyrax! (Mortal Kombat Movie Series),https://redd.it/fioclx
8606,Respect Cyrax! (Mortal Kombat: Legacy),https://redd.it/fiocqs
8607,Respect Sonic the Hedgehog (Sonic the Hedgehog (2020 Film)),https://redd.it/firgvo
8608,Respect Doctor Robotnik (Sonic the Hedgehog (2020 Film)),https://redd.it/fj65a7
8609,Respect Lurtz (Peter Jackson's The Lord of the Rings),https://redd.it/fj7wav
8610,"Respect Koichi Haimawari, the Crawler! (My Hero Academia Vigilantes)",https://redd.it/fj989o
8611,Respect Gran Torino! (My Hero Academia),https://redd.it/fjna4h
8612,"Respect Rumi Usagiyama, Mirko! (My Hero Academia)",https://redd.it/fjnaes
8613,Respect Denki Kaminari! (My Hero Academia),https://redd.it/fjnamv
8614,Respect King Ghidorah (Godzilla: King of the Monsters) [Monsterverse],https://redd.it/fhs5tp
16073,"Respect SCP-388, Ultimate Frisbee (SCP Foundation)",https://redd.it/m8w72i
16074,"Respect Monica Pinkston, D-77777! (SCP Foundation)",https://redd.it/m9bqkv
16075,Respect Dolomite (Jojo's Bizarre Adventure),https://redd.it/mamq6t
16076,Respect Jotua Kujo (JoJo's Bizarre Married Life),https://redd.it/m87dzk
16077,Respect Dr. Orpheus (Venture Bros.),https://redd.it/m888vh
16078,Respect MatPat (Game Theory/Film Theory/Food Theory),https://redd.it/m9aop2
16079,Respect Ebon (Static Shock),https://redd.it/m9xufr
16080,"Respect The Terrific Trio (DCAU, Batman Beyond)",https://redd.it/m9j3p8
16081,Respect Baby Mario and Baby Luigi (Mario & Luigi),https://redd.it/m9wk0u
16082,Respect Recoome (Dragon Ball Z Abridged),https://redd.it/maamvs
16083,Respect The Runaway Kid (Little Nightmares: Secrets of the Maw),https://redd.it/mafrdi
16084,Respect the Hulk (Death Battle),https://redd.it/masc7v
20326,Respect Zachary Zatara (DC Post-Flashpoint),https://redd.it/qnaxne
20327,Respect Willoughby Kipling (DC comics),https://redd.it/qlksmh
20328,"Respect Anton Arcane (DC Comics, New 52)",https://redd.it/qjtu0h
20329,Respect Djinn the Genie! (DC Post-Flashpoint),https://redd.it/qesi1s
20330,"Respect Psych! (DC, Post-Flashpoint)",https://redd.it/q8mqq5
20331,Respect Grant Morrison (Dc Post-Crisis),https://redd.it/p49mea
20332,"Respect Lord Havok (DC, Earth 8, Rebirth)",https://redd.it/q3rebx
20333,"Respect the Turtle (DC Comics, New 52)",https://redd.it/q2iwwy
20334,Respect Mister Nobody (DC Comics),https://redd.it/posia9
20335,"Respect Harvey Dent, Two-Face (DC Comics, New 52)",https://redd.it/pft8ca
20336,Respect Mongal (Dc Post-Crisis),https://redd.it/p3rkln
20337,Respect The Hemo-Goblin (Dc Post-Crisis),https://redd.it/p30cst
20338,Respect Weasel (Dc-Post Crisis),https://redd.it/p4tyn2
20339,"Respect Hat (DC, Post Crisis)",https://redd.it/p1qx8b
20340,Respect Javelin! (DC Comics Post-Crisis),https://redd.it/oy9f35
20341,Respect Bloodsport! (DC Comics Post-Crisis),https://redd.it/ozjtz3
20342,Respect Motherbox (DC Pre-Flashpoint),https://redd.it/oxk0jv
20343,Respect Blackguard (Dc Post-Crisis),https://redd.it/p5fxih
20344,"Respect Savant (DC Comics, Post-Crisis)",https://redd.it/p683tv
20345,"Respect Ratcatcher (DC Comics, Post-Crisis)",https://redd.it/p5erbp
20346,"Respect Hal Jordan (Dc Comics, Earth One)",https://redd.it/qk5x17
20347,Respect Cheetah (DC Extended Universe),https://redd.it/qnzqly
20348,Respect Starro the Conqueror (DCEU),https://redd.it/p8rb3e
20349,Respect Ratcatcher 2 (DCEU),https://redd.it/p2uoy6
20350,Respect Polka-Dot Man (DCEU),https://redd.it/p2uldn
20351,Respect King Shark (DCEU),https://redd.it/ozbbgp
20352,Respect Bloodsport (DCEU),https://redd.it/ozmbjz
20353,Respect Peacemaker (DCEU),https://redd.it/ozmbil
20354,Respect Black Panther (Stars and Stripes Comics),https://redd.it/oyhkqp
20355,Respect Shura and Fuza (One Piece),https://redd.it/qaorzf
20356,Respect Ohm and Holy (One Piece),https://redd.it/q9hcm3
20357,Respect Killer (One Piece),https://redd.it/q8s8lw
20358,Respect Kaido (One Piece),https://redd.it/oyl7oz
20359,Respect Sasaki (One piece),https://redd.it/pjt96z
20360,Respect Captain Hero (Drawn Together),https://redd.it/oyjena
20361,Respect Sparkster (Rocket Knight Adventures),https://redd.it/oypki6
20362,Respect The Fantastic Four (Fantastic Four 1967),https://redd.it/p0i04u
20363,"Respect Reed Richards, The Dark Raider (Earth-944)",https://redd.it/p0i1w4
20364,Respect Rambo! (First Blood),https://redd.it/p0ix2a
20365,Respect Rambo! (Mortal Kombat),https://redd.it/p0j3yw
20366,Respect Rambo! (Blackthorne Publishing),https://redd.it/p0j930
20367,Respect Peter Parker/The Masked Spider (Masked Spider),https://redd.it/p0otgd
20368,Respect Super Thor (Cartoon Hooligans),https://redd.it/p176ka
20369,Respect Nocturne (Danny Phantom),https://redd.it/q15y2q
20370,Respect Desiree! (Danny Phantom),https://redd.it/p14g8z
20371,Respect Gavan Type-G (Space Sheriff Gavan),https://redd.it/p150xm
20372,Respect Sloth (The Goonies),https://redd.it/p1sq53
20373,Respect Yellow (Character Scramble),https://redd.it/p2asq0
20374,Respect Hermes Conrad (Character Scramble),https://redd.it/p1u6aa
20375,Respect Takayuki Yagami (Judgment),https://redd.it/p236za
20376,Respect Pegasus Koga (Saint Seiya: Omega),https://redd.it/pbq6xl
20377,Respect Pegasus Tenma (Saint Seiya: the Lost Canvas),https://redd.it/p3dirj
20378,Respect Super Brainz! (Plants vs Zombies),https://redd.it/p42sya
2759,Respect Fabian Gray (Five Ghosts),https://redd.it/gj5x20
1008,Respect The Justice League (Young Justice),https://redd.it/glkgw6
4876,Respect Origin (Origin) (NSFW),https://redd.it/gmq6xl
5047,Respect Nero (Devil May Cry),https://redd.it/gmqeea
5608,Respect Juan Aguacate (Guacamelee),https://redd.it/goyrwj
11085,Respect Excalibur (Marvel 616),https://redd.it/dcx4lo
11086,Respect Gauntlet (Marvel 616),https://redd.it/cpuvsb
11087,Respect Perun (Marvel 616),https://redd.it/d1q4gb
11088,"Respect Sabra (Marvel, 616)",https://redd.it/cqfsa0
11089,Respect Stingray (Marvel 616),https://redd.it/cs0itp
11090,"Respect Volcana (Marvel, 616)",https://redd.it/dlr74i
11091,Respect Ai Apaec (Marvel 616),https://redd.it/fxiku2
11092,Respect Armadillo (Marvel 616),https://redd.it/d9ym18
11093,"Respect Big Bertha (Marvel, 616)",https://redd.it/d5zfvy
11094,Respect Lara Croft! (Tomb Raider | Survivor Timeline),https://redd.it/gr8i4u
11095,"Respect Mr. 3, `"Loan Shark`" Galdino! (One Piece)",https://redd.it/gnmoxb
11096,Respect Codpiece! (DC Post-Crisis),https://redd.it/gi1dkc
11097,Respect Eeth Koth (Star Wars Canon),https://redd.it/gi1n2i
11098,Respect Ogremon (Digimon Adventure),https://redd.it/gi3eb8
11099,Respect Mean Machine Angel! (2000AD),https://redd.it/gi6yxd
11100,Respect Zorro (1998/2005 Films),https://redd.it/gieg8f
11101,Respect The Hulk (Marvel vs Capcom),https://redd.it/gifa18
11102,"Respect Pavitr Prabhakar, Spider-Man India (Marvel, Earth-50101)",https://redd.it/gipzya
11103,Respect Carrie White (Carrie 1976),https://redd.it/gjcv3q
11104,Respect Elmer Fudd (BATMAN/ELMER FUDD SPECIAL),https://redd.it/gjeb70
11105,Respect Licht Bach(Plunderer Manga),https://redd.it/gji1ek
11106,Respect Toxie Doxie (Marvel 616),https://redd.it/gjlhau
11107,Respect Jack the Ripper (Luther Strode),https://redd.it/gjttzs
11108,Respect Greil (Fire Emblem),https://redd.it/gsp0vl
11109,Respect Dimitri Alexandre Blaiddyd (Fire Emblem: Three Houses),https://redd.it/gjutt5
11110,Respect The Outsiders (Young Justice),https://redd.it/go6xvx
11111,Respect the Cyborgs (Gunslinger Girl),https://redd.it/gjvwsh
11112,Respect Jessie's Lickitung (Pokemon Anime),https://redd.it/gk7gxk
11113,Respect Erika (Pokemon Anime),https://redd.it/gsfaud
11114,Respect Falkner (Pokemon Anime),https://redd.it/gppd66
11115,Respect Jane (The Pigeon Gazette),https://redd.it/gpt9ce
11116,Respect Morishita Daiki (The Hero Who Returned Remains the Strongest in the Modern World ),https://redd.it/gke1h2
11117,"Respect Dr. Doom (Marvel, 90251)",https://redd.it/gkfyqi
11118,Respect Spartan Gray Team (Halo),https://redd.it/gkkb1p
11119,Respect TESS-One (Marvel 616),https://redd.it/gl1m61
11120,Respect V (Devil May Cry),https://redd.it/gpucag
11121,"Respect Cyttorak (Marvel, 616)",https://redd.it/gmvd2s
11122,Respect Turbo Mecha Sonic (Super Mario Bros. Z),https://redd.it/gq2q0m
11123,Respect Power-ups (The Super Mario Bros. Super Show!),https://redd.it/gqy0ns
11124,Respect Abbott Fahai (The Sorcerer and the White Snake),https://redd.it/gtufti
11125,Respect Norgal (Head Lopper),https://redd.it/gu1fhl
11126,Respect Miyamoto Musashi (Baki the Grappler),https://redd.it/gu3exd
11127,Respect Volgarr (Volgarr the Viking),https://redd.it/gu4lhk
11128,Respect Charlie's Angels (Charlie's Angels 2000/2003 Films),https://redd.it/gpxwxk
11129,"Respect Joe Coyne, the Penny Plunderer (Batman, DC Comics)",https://redd.it/gswj43
11130,Respect the Forces of New Genesis [DC Pre-Flashpoint],https://redd.it/gt7pyj
11131,Respect Norm (Phineas and Ferb),https://redd.it/gszboe
11132,Respect the Ents (Peter Jackson's The Lord of the Rings),https://redd.it/gmwkrd
11133,Respect Kasumi Yoshizawa (Persona 5),https://redd.it/gov4db
11134,Respect Jasmine (Pokemon Anime),https://redd.it/gmxp0y
11135,Respect Koga (Pokemon Anime),https://redd.it/gtf25b
11136,"Respect The Ultimate Ninja, Nth Man (Marvel, 8908)",https://redd.it/gtjjt5
11137,Respect Gordon (Agents of SHIELD),https://redd.it/gtj1hq
11138,Respect Misty's Horsea (Pokemon Anime),https://redd.it/gnxwi9
11139,Respect Kingdra (Pokemon Anime),https://redd.it/gnxwiu
11140,Respect Monsters (Monster Hunter Universe),https://redd.it/gndn0u
11141,"Respect Mr. Mxyzptlk (DC Comics, Injustice)",https://redd.it/go34sb
11142,"Respect Lacile, The Knight of Blue Sky (Soukyuu No Ariadne)",https://redd.it/go3k6q
11143,Respect Turner (Lugaru and Overgrowth),https://redd.it/grqpd5
11144,Respect Ragnar Blackmane (Warhammer 40k),https://redd.it/gs2kjm
11145,Respect Peter Parquagh The Spider (Marvel 1602),https://redd.it/gsc2fl
11146,Respect the Poptropican (Poptropica),https://redd.it/gnfhjo
11147,Respect Jebediah McKenna (Forest Warrior 1996 Film),https://redd.it/gnk1f1
11148,Respect Allah (The Qur'an),https://redd.it/gpf8qh
20379,Respect the Chosen Ones (Class of the Titans),https://redd.it/p4821g
20380,Respect Jay (Class of the Titans),https://redd.it/p482vt
20381,Respect Atlanta (Class of the Titans),https://redd.it/p483k3
20382,Respect Herry (Class of the Titans),https://redd.it/p484f9
20383,Respect Archie (Class of the Titans),https://redd.it/p48550
20384,Respect Theresa (Class of the Titans),https://redd.it/p485jf
20385,Respect Odie (Class of the Titans),https://redd.it/p485y5
20386,Respect Neil (Class of the Titans),https://redd.it/p486i0
20387,Respect Cooler (Dragon Ball Franchise),https://redd.it/p54983
20388,Respect Marisa Kirisame (Touhou: PC-98),https://redd.it/qcrcc9
20389,Respect Kasen Ibaraki (Touhou),https://redd.it/qbbkzi
20390,Respect Mima (Touhou),https://redd.it/p7el9u
20391,Respect Yumemi Okazaki (Touhou)),https://redd.it/p5emwv
20392,Respect Manfred von Wreckerstein (The Thing (1979)),https://redd.it/p6b0tr
