id,title,link
2797,Respect Sven The Returned/The Immortal (Northlanders),https://redd.it/92vjk5
2798,Respect Officer Downe (Image Comics),https://redd.it/5eee7m
2799,"Respect The Yautja/Predator (`"Predator`" Franchise)",https://redd.it/4vaaq7
2800,Respect Luke Ryan (The Provider),https://redd.it/77hfxt
2801,Respect the Rat Queens (Rat Queens),https://redd.it/74f5nl
2804,[Respect] Mako (Image Comics),https://redd.it/5xi03d
2805,Respect Scud (Scud: The Disposable Assassin),https://redd.it/52bitv
2806,Respect the Shaolin Cowboy! (The Shaolin Cowboy),https://redd.it/70pyze
2807,[NSFW] Respect Shirtless Bear-Fighter! (Shirtless Bear-Fighter!),https://redd.it/82bnt5
2808,Respect The Silver Soldiers (Truthmonger Comics),https://redd.it/771y7y
2809,Respect: Marv (Sin City),https://redd.it/4url91
2810,Respect Coach Euless Boss (Southern Bastards),https://redd.it/8zllli
2811,Respect The Spider! (Dynamite Comics),https://redd.it/axjil4
2812,Respect The Super Angry Birds,https://redd.it/6alobs
2813,Respect Leo Winters (Suicide Risk),https://redd.it/7eop63
2814,Respect the Super Gods (SuperGod),https://redd.it/3t45rq
2815,Respect Tarzan: Lord of the Apes! (Tarzan),https://redd.it/4uiyp4
2816,Respect Addison Brody (Tomboy),https://redd.it/6mbpn8
2817,Respect Smax (ABC),https://redd.it/bu4gjh
2818,Über-The Battleship's MEGA Thread,https://redd.it/5nb708
2820,Respect: Vampirella (Vampirella comics),https://redd.it/4v4cjx
2821,Respect Wesley Gibson (Wanted Comics),https://redd.it/5dgqsm
2822,Respect Broll Bearmantle (Warcraft),https://redd.it/5xqwzu
2823,Respect Persephone (The Wicked + The Divine),https://redd.it/6usd1a
2824,Respect: Pitt (Image comics),https://redd.it/4vfjbo
2825,Respect Black Mage (8-Bit Theater),https://redd.it/6rfwln
2826,Respect Fighter (8-Bit Theater),https://redd.it/6rfw6s
2827,Respect The Light Warriors (8-Bit Theater),https://redd.it/6kr3vj
2828,Respect Red Mage (8-Bit Theater),https://redd.it/6rfxbi
2829,Respect Sarda (8 Bit Theater),https://redd.it/30jhb6
2830,Respect Thief (8-Bit Theater),https://redd.it/6rfww8
2831,Respect Deadhead (Blackwidow Apocalypse),https://redd.it/8h7chs
2832,Respect Hendrick Bastardsword (Blackwidow Apocalypse),https://redd.it/8h7ceh
2802,Respect Marko! (Saga),https://redd.it/qw3s36
2803,Respect The Will! (Saga),https://redd.it/qw3s4i
2782,"Respect Le Chevalier Noir, Arpin Lusene! (Donald Duck Comics Universe)",https://redd.it/d7jym3
2819,Respect the Umbrella Academy (Dark Horse Comics),https://redd.it/ivat8v
2833,Respect Ingrid Gottoli (Blackwidow Apocalypse),https://redd.it/8h7c8o
2834,"Respect Isabel `"Izzy`" Fisher (Blackwidow Apocalypse)",https://redd.it/8h7cqk
2835,Respect Nathan Discord (Blackwidow Apocalypse),https://redd.it/8h7cmf
2836,Respect Dr. McNinja,https://redd.it/2ellp9
2837,Respect Frans Rayner! (Dr. McNinja),https://redd.it/68mxh3
2838,[Respect] Ron Wizard (Dr. McNinja),https://redd.it/766lqo
2839,Respect Elliot Dunkel (El Goonish Shive),https://redd.it/781wm1
2840,Respect Grace Sciuridae (El Goonish Shive),https://redd.it/7820xo
2841,Respect the Main Eight (El Goonish Shive),https://redd.it/782pmd
2842,Respect Nanase Kitsune (El Goonish Shive),https://redd.it/7825bj
2843,Respect the Goblin Adventuring Party (Goblins),https://redd.it/7uyjt2
2844,Respect Kore the Dwarven Paladin (Goblins),https://redd.it/7usltn
2845,Respect Minmax the Unstoppable Warrior (Goblins),https://redd.it/5c5o4f
2846,Respect Achilles (Grrl Power),https://redd.it/4afgr5
2847,Respect Halo (Grrl Power),https://redd.it/481ne3
2848,Respect Maxima (Grrl Power),https://redd.it/4alfhh
2849,Respect the Homestuck Universe!,https://redd.it/7lbplm
2850,Respect Bro Strider! (Homestuck),https://redd.it/7d91dp
2851,Respect Dad (Homestuck),https://redd.it/4nvlnw
2852,Respect Dave Strider! (Homestuck),https://redd.it/7fgk6y
2853,Respect Dirk Strider! (Homestuck),https://redd.it/7f0lqx
2854,Respect Jade Harley! (Homestuck),https://redd.it/7ffbn0
2855,Respect Jake English! (Homestuck),https://redd.it/7f7jgz
2856,Respect Jane Crocker! (Homestuck),https://redd.it/7f8zin
2857,Respect John Egbert! (Homestuck),https://redd.it/7fmzku
2859,Respect Rose Lalonde! (Homestuck),https://redd.it/7fiqvc
2860,Respect Roxy Lalonde! (Homestuck),https://redd.it/7dy4d3
2861,Respect Aradia Megido! (Homestuck),https://redd.it/7ktl72
2862,Respect Equius Zahhak! (Homestuck),https://redd.it/7ic15f
2863,Respect Eridan Ampora! (Homestuck),https://redd.it/7kaj9g
2864,Respect Gamzee Makara! (Homestuck),https://redd.it/7kee9j
2865,"Respect Her Imperious Condescension, Betty Crocker! (Homestuck)",https://redd.it/7k2rh7
2866,Respect Kanaya Maryam! (Homestuck),https://redd.it/7l1j0y
2867,Respect Karkat Vantas! (Homestuck),https://redd.it/7ev6by
2868,Respect Meenah Peixes! (Homestuck),https://redd.it/7ev6bj
2869,Respect Nepeta Leijon! (Homestuck),https://redd.it/7ic0a9
2870,Respect Sollux Captor! (Homestuck),https://redd.it/7ke2za
2871,Respect Tavros Nitram! (Homestuck),https://redd.it/7kac96
2872,Respect Terezi Pyrope (Homestuck),https://redd.it/4sc07d
2873,Respect Vriska Serket! (Homestuck),https://redd.it/7f32bf
2874,Respect Becquerel! (Homestuck),https://redd.it/7k2z55
2875,Respect The Felt! (Homestuck),https://redd.it/7l622q
2876,Respect Jack Noir! (Homestuck),https://redd.it/7ezm72
2878,Respect Spades Slick (Homestuck),https://redd.it/64b0x9
2879,Respect 42! (Kiwi Blitz),https://redd.it/ae6k1q
2880,Respect Blitz! (Kiwi Blitz),https://redd.it/8gdou6
2881,Respect Gear! (Kiwi Blitz),https://redd.it/77eoqt
2882,Respect Belkar Bitterleaf! (Order of the Stick),https://redd.it/5cq0u0
2883,Respect Durkon Thundershield! (Order of the Stick),https://redd.it/5cmda4
2884,Respect Elan! (Order of the Stick),https://redd.it/5cha2r
2885,Respect General Tarquin! [Order of the Stick],https://redd.it/4c7w8p
2886,Respect Haley Starshine! (Order of the Stick),https://redd.it/5ckn8b
2887,Respect Nale [The Order of the Stick],https://redd.it/78d9eu
2888,Respect Roy Greenhilt! (Order of the Stick),https://redd.it/5cb21z
2889,Respect Saha Kapoor (The Order of the Stick: Good Deeds Gone Unpunished),https://redd.it/9ek37y
2890,Respect Vaarsuvius! (Order of the Stick),https://redd.it/5cs75t
2891,Respect Ace Dick! (Problem Sleuth),https://redd.it/bhge8u
2892,Respect Hysterical Dame and Nervous Broad! (Problem Sleuth),https://redd.it/bhge79
2893,Respect Mobster Kingpin! (Problem Sleuth),https://redd.it/bhge86
2894,Respect Pickle Inspector! (Problem Sleuth),https://redd.it/bhge9j
2895,Respect Problem Sleuth! (Problem Sleuth),https://redd.it/bhgea9
2896,Respect Alison Green/Mega Girl (Strong Female Protagonist),https://redd.it/8a63j9
2897,Respect Chris Mackey/Furnace (Strong Female Protagonist),https://redd.it/8cfg1z
2898,Respect Daniel Wolczek/Cleaver (Strong Female Protagonist),https://redd.it/8cplk2
2899,Respect Mary Kim/Moonshadow (Strong Female Protagonist),https://redd.it/8c1db9
2900,Respect Patrick Andrews/Menace (Strong Female Protagonist),https://redd.it/926nsl
2901,Respect Tara Lynn Cooper/Feral (Strong Female Protagonist),https://redd.it/8c88bf
2902,Respect Coyote (Tails Gets Trolled),https://redd.it/6l2lhx
2903,[NSFW] Respect Demaro (Tails Gets Trolled),https://redd.it/9g4j8s
2904,[NSFW] Respect Garry (Tails Gets Trolled),https://redd.it/9ft2py
2905,Respect Rob the Guy with No Ears (Tails Gets Trolled),https://redd.it/688797
2906,Respect the Emo Troll! (Tails Gets Trolled),https://redd.it/6h4m8h
2907,[NSFW] [NSFL] Respect Tails (Tails Gets Trolled),https://redd.it/9fmpqi
2908,Respect the Troll King (Tails Gets Trolled),https://redd.it/64piyl
2910,Respect: BHG (xkcd),https://redd.it/2mmoi4
2911,Respect Gnome Ann (XKCD),https://redd.it/4rzvxq
2912,Respect Alice (Alice Grove),https://redd.it/82f3ku
2913,Respect Ice and Crush Groove! (And It Don't Stop),https://redd.it/7rttta
2914,Respect Atomic Laundromat,https://redd.it/65k4kp
2915,Atomic Robo (Atomic Robo),https://redd.it/68w337
2916,Respect Dr. Dinosaur (Atomic Robo),https://redd.it/68xuuo
2877,"Respect Lord English(Caliborn), The Lord of Time! (Homestuck)",https://redd.it/qc1pmo
2919,Respect Book Cop! (Axe Cop),https://redd.it/6r7yjx
2920,Respect Abigail! (BACK),https://redd.it/88eaak
2921,Respect Bunny! (Blade Bunny),https://redd.it/6cvp6z
2922,Respect Life! (Owlturd/Bluechair),https://redd.it/503avl
2923,Respect Shen (Bluechair/Owlturd/Shencomix),https://redd.it/7rfeci
2924,Respect Biff (The Book of Biff),https://redd.it/4l7u30
2925,Respect Bravoman! (Bravoman: Super-Unequaled Hero of Excellence),https://redd.it/3sc9d0
2926,Respect Kirby (Brawl in the Family),https://redd.it/bxf2tw
2927,Respect Alex Williams (Captain SNES: The Game Masta),https://redd.it/4o60sj
2928,Respect Gordon Frohman (Concerned: The Half-Life and Death of Gordon Frohman),https://redd.it/3o5a58
2929,Respect Crash Bandicoot! (Crash Bandicoot Retold),https://redd.it/6p9k4m
2930,Respect The Purple Shirted Eye Stabber (Cyanide and Happiness),https://redd.it/5dvnn8
2931,Respect Ted Bear (Cyanide and Happiness),https://redd.it/5rbwus
2932,Respect Cezar [Demon's Mirror],https://redd.it/794zej
2933,Respect Kim Ross (Dresden Codak),https://redd.it/8czc62
2934,Respect Amazi-Girl! (Dumbing of Age),https://redd.it/68i8tl
2935,Respect Agatha Heterodyne (Girl Genius),https://redd.it/7ug9bb
2936,"Respect Chi, the Daughter of Aku! (Grim Tales From Down Below)",https://redd.it/6u2tn4
2937,Respect Dark Danny (Grim Tales From Down Below),https://redd.it/br4rqu
2938,Jones [Gunnerkrigg Court],https://redd.it/5pk9h3
2939,Respect Nameless Peon [HUGE QUEST],https://redd.it/66fihu
2940,Respect Brianne Ironheart (Ironheart-Rune),https://redd.it/7zw6yo
2941,"Respect Allison `"Ally`" Schwartz! (It Hurts!)",https://redd.it/79iu2m
2942,Respect Pasqualo Trianglini! (It Hurts!!),https://redd.it/7a71f5
2943,Respect Joyce Brown! (It's Walky!),https://redd.it/61cmqm
2944,Respect the JL8 Universe,https://redd.it/5ryml1
2945,Respect Katsuko - The Invinsible Goddess (Katsuko Comic 1) [NSFW],https://redd.it/8d5wzb
2946,Respect Kid Radd. (Kid Radd),https://redd.it/3njwkx
2947,Respect Klonoa! (Klonoa: Dream Traveler of Noctis Sol),https://redd.it/aaph1z
2948,Respect Kubera Leez (Kubera),https://redd.it/4ywoe4
2949,Respect Nameless Protagonist [Landwalker's Nuzlocke] (Pokemon Fan Comic),https://redd.it/5coz1c
2950,Respect Red [Landwalker's Yellow Nuzlocke] (Pokemon Fan Comic),https://redd.it/695gf0
2951,"Respect Ghorrokhan Bloodeye, the Last Orc",https://redd.it/315qo3
2952,Respect The League of Super Redundant Heroes (The League of Super Redundant Heroes),https://redd.it/6c1td0
2953,Respect Lightbringer! (Linkara's Lightbringer),https://redd.it/bjqmh8
2954,Respect Richard Ashendale (Looking For Group),https://redd.it/5001gi
2955,Respect Commander Badass (Manly Guys Doing Manly Things),https://redd.it/7r86tc
2956,Respect Jared Kowalski and Mr. Fish (Manly Guys Doing Manly Things),https://redd.it/59ho2t
2957,Respect minus (minus),https://redd.it/77udxo
2958,Respect Atticus Brent (Mokepon),https://redd.it/5jujei
2959,Respect Mega Man [MS Paint Masterpieces],https://redd.it/54y16f
2960,Respect Dracula (My Dad is Dracula),https://redd.it/8jwdhz
2961,Respect Natty (Natty),https://redd.it/9jt32o
2962,Respect The Girl! (Necropolis),https://redd.it/660fos
2963,Respect Erma! (Outcast),https://redd.it/8aovq3
2964,Respect Maxwell Puckett (Paranatural),https://redd.it/79os8d
2965,Respect Ruby (Pokemon: Hard Mode),https://redd.it/6lzttq
2966,Respect Poppy o Possum(Poppy O Possum),https://redd.it/93ua6z
2968,Respect Kit Crimson [Kit's Nuzlocke Adventure] (Pokemon Fan Comic),https://redd.it/3xq55z
2969,NSFW Respect Faye Artemis (Shapeshifter),https://redd.it/4lpwzw
2970,Respect Heartful Punch! (Sleepless Domain),https://redd.it/a05ye8
2971,Respect Undine! (Sleepless Domain),https://redd.it/a066sq
2972,Respect Snowflame (Snowflame: The Fan-Comic),https://redd.it/65mw85
2973,Christian Weston Chandler (Sonichu Comics),https://redd.it/5mstki
2974,Respect Sonichu! [Sonichu],https://redd.it/42ykbj
2975,Respect Colonel Glass (Spinnerette),https://redd.it/64lov4
2976,Respect Starpunch Girl (Star☆Punch Girl),https://redd.it/6t3dyo
2977,Respect Stupid Fox,https://redd.it/32q4mv
2978,Respect Braveun (Sugar Bits),https://redd.it/64msxg
2979,Respect Superbitch (Superbitch),https://redd.it/5woz74
2980,Respect Superbitch Inc. (Superbitch),https://redd.it/5wowu4
2981,Respect Vladimir Putin (Superputin),https://redd.it/8sw8dq
2982,Respect Walraptor (Tales of Stuff n' Things),https://redd.it/3pgdff
2983,Respect The Gamer (The Gamer),https://redd.it/ay1mrg
2984,Duane Adelier [Unsounded],https://redd.it/5otlxy
2985,Respect the Val and Isaac Universe,https://redd.it/bs5rlm
2986,Respect Furio Mumbasa(Vibe)!,https://redd.it/4l2c0e
2987,Respect Ronnie (Whomp!),https://redd.it/9troas
2988,Respect Chuck [Weapon Brown: Blockhead's War],https://redd.it/3vv3bf
2989,Respect Jone 'Half-Orc' White Eye [Yet Another Fantasy Gamer Comic],https://redd.it/65hrbh
2990,Respect Ball (666 Satan),https://redd.it/48n0ia
2991,Respect Cross Biancina (666 Satan),https://redd.it/48kru3
2992,Respect Dofuwa Longinus (666 Satan),https://redd.it/6aima7
2993,Respect Jio Freed (666 Satan),https://redd.it/5laqti
2994,Respect Kirin (666 Satan),https://redd.it/58x3iz
2995,Respect Kujaku (666 Satan),https://redd.it/4a75jh
2996,Respect Shuri (666 Satan),https://redd.it/59dszi
2997,Respect Agito/Akito/Lind Wanijima (Air Gear),https://redd.it/4mdhfd
2998,Respect Kilik (Air Gear),https://redd.it/8scq5s
2999,Respect Nike Takeuchi (Air Gear),https://redd.it/8rlrwp
3000,Respect Simca (Air Gear),https://redd.it/4r3583
3001,Respect Sora Takeuchi (Air gear),https://redd.it/8scpsc
3002,Respect Akame (Akame Ga Kill),https://redd.it/71ajv2
3003,Respect Esdeath (Akame Ga Kill),https://redd.it/4wz4dk
3004,Respect Leone (Akame Ga Kill),https://redd.it/4wz0ze
3005,Respect Lubbock (Akame Ga Kill),https://redd.it/4wyzdc
3006,Respect Mine (Akame Ga Kill),https://redd.it/4wyx8h
3008,Respect Tatsumi (Akame Ga Kill!),https://redd.it/b7eo5b
3009,Respect Agni Morizono! (Alice in Borderland),https://redd.it/6uy4lc
3010,Respect Karube Daikichi! (Alice in Borderland),https://redd.it/6ueie3
3011,Respect Ryouhei Arisu! (Alice in Borderland),https://redd.it/6v4lki
3012,"Respect Shiirabi Isao, the King of Spades! (Alice in Borderland)",https://redd.it/6ux3a4
3013,Respect Usagi Yuzuha! (Alice in Borderland,https://redd.it/6v4lgb
3014,Respect The Afterlife Battlefront (Angel Beats!),https://redd.it/32bfis
3015,Respect Hideki Hinata (Angel Beats!),https://redd.it/32bg8a
3016,Respect Kanade Tachibana (Angel Beats!),https://redd.it/31glnp
3017,Respect Noda (Angel Beats!),https://redd.it/31xwae
3018,Respect Shiina (Angel Beats!),https://redd.it/31nigd
3019,Respect Yuri Nakamura (Angel Beats!),https://redd.it/31nq86
3020,Respect Akabane Karma (Assassination Classroom),https://redd.it/6dad9m
3021,Respect Class 3-E (Assassination Classroom),https://redd.it/8o8w4f
3022,Respect the Grim Reaper (Assassination Classroom),https://redd.it/7bnd4b
3023,Respect Hinata Okano (Assassination Classroom),https://redd.it/8mzrgi
3024,Respect Hiroto Maehara (Assassination Classroom),https://redd.it/8mqohc
3025,Respect Itona Horibe (Assassination Classroom),https://redd.it/7ayg67
3026,Respect Irina Jelavic (Assassination Classroom),https://redd.it/7aco4s
3027,"Respect Justice `"Masayoshi`" Kimura (Assassination Classroom)",https://redd.it/8mzrhh
3028,Respect Kaede Kayano (Assassination Classroom),https://redd.it/7be61n
3029,Respect Koro Sensei (Assassination Classroom),https://redd.it/7a46dg
3030,Respect Kōtarō Takebayashi (Assassination Classroom),https://redd.it/8niv5z
3031,Respect Manami Okuda (Assassination Classroom),https://redd.it/8niv6i
3032,Respect Meg Kataoka (Assassination Classroom),https://redd.it/8mzrfg
3033,Respect Rinka Hayami (Assassination Classroom),https://redd.it/826nlo
3034,Respect Ritsu (Assassination Classroom),https://redd.it/7ajz1q
3035,Respect Ryōma Terasaka (Assassination Classroom),https://redd.it/8mai4v
3036,Respect Ryūnosuke Chiba (Assassination Classroom),https://redd.it/826nmp
3037,Respect Shiota Nagisa (Assassination Classroom),https://redd.it/6dada8
3038,Respect Sōsuke Sugaya (Assassination Classroom),https://redd.it/8o0jpj
3039,Respect Tadaomi Karasuma (Assassination Classroom),https://redd.it/6dadi8
3040,Respect Taiga Okajima (Assassination Classroom),https://redd.it/8o0jp7
3041,Respect Taisei Yoshida (Assassination Classroom),https://redd.it/8n92wq
3042,Respect Takuya Muramatsu (Assassination Classroom),https://redd.it/8n92w1
3043,Respect Tomohito Sugino (Assassination Classroom),https://redd.it/8nsb57
3044,Respect Yukiko Kanzaki (Assassination Classroom),https://redd.it/8nsb50
3045,Respect Yuma Isogai (Assassination Classroom),https://redd.it/8mqoho
3046,Respect Astro Boy (Original Astro Boy Manga),https://redd.it/7g13rr
3047,Respect Atlas (Astro Boy),https://redd.it/7kbg2l
3048,Respect Blue Knight (Astro Boy),https://redd.it/7fdddv
3049,Respect Pluto (Astro Boy),https://redd.it/7ctk80
3050,Respect The Seven Strongest Robots (Astro Boy),https://redd.it/7ctjy4
3051,Respect The Armored Titan (Attack On Titan),https://redd.it/buv4ya
3052,Respect The Beast Titan (Attack On Titan),https://redd.it/bul8ul
3053,Respect The Colossal Titan (Attack On Titan),https://redd.it/buy9dp
3054,[Respect] Dancing Titan (Shingeki no Kyojin),https://redd.it/2rb29j
3055,[Respect] Eren Jaeger (Shingeki no Kyojin),https://redd.it/32l7gt
3056,[Respect] Female Titan (Shingeki no Kyojin),https://redd.it/2r77b5
3057,Respect The Jaw Titan (Attack on Titan),https://redd.it/buhxo6
3058,[Respect] Levi (Shingeki no Kyojin),https://redd.it/4nfocy
3060,Respect Zeke Yeager (Shingeki No Kyojin),https://redd.it/5qma00
3061,Respect Dark Schneider (Bastard!),https://redd.it/5iojzp
3062,Satan (Bastard!!),https://redd.it/9h8oxd
3063,Uriel (Bastard!!),https://redd.it/9frm94
3064,Respect Alita (Battle Angel Alita),https://redd.it/838dts
3065,Respect Caerula Sanguis (Battle Angel Alita),https://redd.it/ay0qbb
3066,Respect Sechs (Battle Angel Alita),https://redd.it/ay0qmc
3067,Respect Hajime Kanzaki! (Beelzebub),https://redd.it/9ei2vj
3069,Respect Izō Aiba! (Beelzebub),https://redd.it/9dzb4s
3070,Respect Jabberwock! (Beelzebub),https://redd.it/9e7iwc
3071,"[NSFW] Respect the Child Raising Badass, Oga Tatsumi and the Lord of the Flies, Kaiser de Emperana Beelzebub IV (Beelzebub)",https://redd.it/78gz1m
3072,Respect Takayuki Furuichi! (Beelzebub),https://redd.it/9e7o4c
3073,Respect Yōhei Nasu! (Beelzebub),https://redd.it/9ehvfm
3074,Respect Father Mozgus and his Disciples (Berserk),https://redd.it/6ti9vp
3079,Respect Nosferatu Zodd! (Berserk),https://redd.it/mr4y9v
3077,Respect Irvine (Berserk),https://redd.it/6zmwwr
3078,Respect Locus (Berserk),https://redd.it/6zuh9h
3080,Respect Rakshas (Berserk),https://redd.it/6ztth1
3081,Respect Serpico (Berserk),https://redd.it/49icgm
3082,Respect Silat and the Tapasa of the Bākiraka (Berserk),https://redd.it/6tbza2
3075,"Respect `"The Great Flame Dragon`" Grunbeld (Berserk)",https://redd.it/hjdyq2
3007,Respect Seryu Ubiquitous! (Akame Ga Kill!),https://redd.it/kwszoq
3059,Respect Mikasa Ackerman (Shingeki no Kyojin),https://redd.it/oiyg51
3084,Respect Nosferatu Zodd! (Berserk),https://redd.it/8w3tom
3085,Respect Momiji Binboda! (Binbougami-ga!),https://redd.it/bi3k5b
3086,Respect Ranmaru Rindou! (Binbougami-ga!),https://redd.it/bi3liv
3087,Respect Ichiko Sakura! (Binbougami-ga!),https://redd.it/bi3ljl
3088,Respect Asta! (Black Clover),https://redd.it/8qyvfh
3089,Respect Wizard King Julius Novachrono! (Black Clover),https://redd.it/a6ra6x
3090,Respect Luck Voltia! (Black Clover),https://redd.it/9oj9xj
3091,Respect Mars! (Black Clover),https://redd.it/9p1ur6
3092,Respect Black★Rock Shooter (2012 anime),https://redd.it/3r5545
3093,Respect Black★Rock Shooter (OVA),https://redd.it/40bzcx
3094,Respect Rock (Black★Rock Shooter: Innocent Soul),https://redd.it/42bwj8
3095,Respect Strength (Black★Rock Shooter),https://redd.it/43ygak
3096,[Respect] Cibo (Blame!),https://redd.it/3jfdpu
3097,[Respect] Killy (Blame!),https://redd.it/3jf5od
3098,Respect Killy (Blame! [2017 Manga]),https://redd.it/91og0v
3099,Killy (Blame! [2017 Movie]),https://redd.it/91oa2s
3100,[Respect] Sanakan (Blame!),https://redd.it/3jf88s
3101,Respect Hakaze Kusaribe (Blast of Tempest),https://redd.it/84fa6w
3102,Respect Mahiro Fuwa (Blast of Tempest),https://redd.it/85ho8q
3103,Respect Megumu Hanemura (Blast of Tempest),https://redd.it/86ijp4
3104,Respect Natsumura Kusaribe (Blast of Tempest),https://redd.it/7wrjy6
3105,"Respect the Noveno Espada, Aaroniero Arruruerie (Bleach)",https://redd.it/6rtu9t
3106,Respect Barragan Luisenbairn (Bleach),https://redd.it/623w38
3107,"Respect Coyote Starrk, the Primera Espada! (Bleach)",https://redd.it/4xhud4
3108,Respect Dordoni Alessandro Del Socaccio! (Bleach),https://redd.it/auh7dn
3109,Respect Findorr Calius (Bleach),https://redd.it/axc7hg
3110,"Respect the Sexta Espada, Grimmjow Jaegerjaquez (Bleach)",https://redd.it/6rczxs
3111,Respect Nelliel Tu Odelschwanck! (Bleach),https://redd.it/b26tnl
3112,"Respect the Quinta Espada, Nnoitora Gilga (Bleach)",https://redd.it/6r5qp9
3113,"Respect the Octava Espada, Szayelaporro Grantz (Bleach)",https://redd.it/6ro9tq
3114,Respect Tier Harribel (Bleach),https://redd.it/6qs7p5
3115,Respect the Cuarto Espada - Ulquiorra Cifer (Bleach),https://redd.it/6r2p7r
3116,"Respect the Decimo y Cero Espada, Yammy Llargo (Bleach)",https://redd.it/6rtudy
3117,"Respect the Septima Espada, Zommari Rureaux (Bleach)",https://redd.it/6rk0tu
3118,Respect Kugo Ginjo (Bleach),https://redd.it/6v40sz
3119,Respect Shukuro Tsukishima (Bleach),https://redd.it/6u3bwz
3120,Respect Orihime Inoue (Bleach),https://redd.it/5wwko3
3121,Respect Yasutora Sado (Bleach),https://redd.it/6znxk9
3122,Respect Yukio Hans Vorarlberna (Bleach),https://redd.it/6v40mn
3123,Respect Sternritter D - Askin Nakk Le Vaar (Bleach),https://redd.it/6o9our
3124,Respect Stern Ritter F - Äs Nödt (Bleach),https://redd.it/6nt3s6
3125,Respect Sternritter E - Bambietta Basterbine (Bleach),https://redd.it/6o2uyj
3126,Respect Stern Ritter H - Bazz-B (Bleach),https://redd.it/6ng420
3127,Respect Sternritter K - BG9 (Bleach),https://redd.it/6mtgzj
3128,Respect Stern Ritter T - Candice Catnipp (Bleach),https://redd.it/6ltgst
3129,Respect Sternritter M - Gerard Valkyrie (Bleach),https://redd.it/6mfkvl
3130,Respect Sternritter Z - Giselle Gewelle (Bleach),https://redd.it/6kt3u3
3131,Respect Sternritter V - Gremmy Thoumeaux (Bleach),https://redd.it/6lm9vn
3132,Respect Stern Ritter B - Jugram Haschwalth (Bleach),https://redd.it/6oqala
3133,Respect Stern Ritter X - Lille Barro (Bleach),https://redd.it/6l7onf
3134,Respect Stern Ritter G - Liltotto Lamperd (Bleach),https://redd.it/6nmbe1
3135,Respect Sternritter S - Mask De Masculine (Bleach),https://redd.it/6m2l80
3136,Respect Stern Ritter P - Meninas McAllon (Bleach),https://redd.it/6m9hkn
3137,"Respect Stern Ritter U, R, Q, O, N, and I - NaNaNa Najahkoop, Jerome Guizbatt, Berenice Gabrielli, Driscoll Berci, Robert Accutrone and Cang Du (Bleach)",https://redd.it/6n96k7
3138,Respect Sternritter W - Nianzol Weizol (Bleach),https://redd.it/6lf62u
3139,Respect Stern Ritter L - PePe Waccabrada (Bleach),https://redd.it/6mlnfb
3140,Respect Sternritter C - Pernida Parnkgjas (Bleach),https://redd.it/6ogma8
3141,Respect Sternritter J - Quilge Opie (Bleach),https://redd.it/6n315y
3142,Respect Sternritter Y - Royd and Loyd Lloyd (Bleach),https://redd.it/6kzhr3
3143,Respect Stern Ritter Σ - Shaz Domino (Bleach),https://redd.it/6knc8r
3144,Respect Uryū Ishida (Bleach),https://redd.it/6p0b57
3145,Respect Yhwach (Bleach),https://redd.it/6p87bq
3146,Respect Sosuke Aizen (Bleach),https://redd.it/5pq8l4
3147,Respect Byakuya Kuchiki (Bleach),https://redd.it/7as9ly
3148,Respect Genryūsai Shigekuni Yamamoto (Bleach),https://redd.it/6znxlc
3149,Respect Ichibē Hyōsube,https://redd.it/2yam4r
3150,Respect Ichigo Kurosaki (Bleach),https://redd.it/c5pftj
3151,Respect Ikkaku Madarame (Bleach),https://redd.it/67kayf
3152,13 days of respect threads day 5 Izuru Kira.,https://redd.it/2bx12l
3153,Respect Kaname Tosen (Bleach),https://redd.it/6vsohg
3154,Respect Kenpachi Zaraki! (Bleach),https://redd.it/5cu4bg
3155,Respect Kisuke Urahara (Bleach),https://redd.it/8kegfg
3156,Respect Mayuri Kurotsuchi (Bleach),https://redd.it/6e1efr
3157,Respect Momo Hinamori! (Bleach),https://redd.it/bp3rpq
3158,Respect Renji Abarai (Bleach),https://redd.it/6s70af
3159,Respect Retsu Unohana! (Bleach),https://redd.it/b19mvp
3160,Respect Rukia Kuchiki (Bleach),https://redd.it/7as9pu
3161,Respect Sajin Komamura (Bleach),https://redd.it/6ywa09
3162,13 days of respect threads day 8: Shuhei Hisagi.,https://redd.it/2c7ojn
3163,Respect Shunsui Kyoraku (Bleach),https://redd.it/6cxxl9
3164,"Respect Soi Fon, the Captain of the Second division of the Gotei 13. (Bleach)",https://redd.it/3bsnkv
3165,Respect Tōshirō Hitsugaya (Bleach),https://redd.it/68mqwm
3166,Respect Yoruichi Shihoin [Bleach],https://redd.it/4rezzb
3167,Respect Kon! (Bleach),https://redd.it/b2apcm
3168,Respect Ururu Tsumugiya (Bleach),https://redd.it/6c8p85
3169,Respect Lucifer (Blue Exorcist),https://redd.it/9hvi10
3170,Respect Mephisto Pheles (Blue Exorcist),https://redd.it/9m81bj
3171,Respect Rin Okumura (Blue Exorcist),https://redd.it/b9datn
3172,Respect Agnès Oblige (Bravely Default),https://redd.it/6p2z1x
3173,Respect Edea Lee (Bravely Default),https://redd.it/6padt9
3174,Respect Ringabel (Bravely Default),https://redd.it/6padj3
3175,Respect Tiz Arrior (Bravely Default),https://redd.it/6p2yap
3176,Respect Atsushi Nakajima (Bungou Stray Dogs),https://redd.it/a0lrgg
3178,Respect Francis Scott Key Fitzgerald! (Bungo Stray Dogs),https://redd.it/7dnltv
3179,Respect The Guild! (Bungo Stray Dogs),https://redd.it/91m8ap
3180,Respect Howard Phillips Lovecraft! (Bungo Stray Dogs),https://redd.it/7b7ivf
3181,Respect Kazuki Muto! (Buso Renkin),https://redd.it/79pfpv
