id,title,link
11,Elijah Price/Mr. Glass,https://www.reddit.com/r/respectthreads/comments/bccj18/kevin_wendell_crumb_the_horde_unbreakable_trilogy/ekpghf8/
12,Respect the Van-Pires Universe!,https://redd.it/bp31o4
15,"Respect Slade Wilson, a.k.a. Deathstroke (Arrow/Arrowverse)",https://redd.it/alahud
16,Respect the Green Arrow! [CW's Arrowverse],https://redd.it/5isiq4
18,"Respect Leonard Snart, AKA Captain Cold (Flarrowverse)",https://redd.it/65moej
19,Respect The Flash (CW),https://redd.it/4nmwbe
20,Respect Girder (CW Flash series),https://redd.it/6idk5w
23,Respect Gorilla Grodd(CW Flash series),https://redd.it/6sk2re
24,Respect King Shark (CW Flash),https://redd.it/6u57em
25,Respect Reverse Flash (CW),https://redd.it/4nmwit
26,Respect Solovar (CW Flash series),https://redd.it/6p3evo
27,"Respect Mark Mardon, AKA Weather Wizard [The Flash/Arrowverse]",https://redd.it/78lg6o
28,Respect Zoom (CW),https://redd.it/4nmwmd
29,Respect Kuasa (Arrowverse),https://redd.it/9rn68x
30,"Respect Mari McCabe, AKA Vixen (Vixen/Arrowverse)",https://redd.it/9n1nzt
31,John Constantine (CW: Arrowverse),https://redd.it/9bpax1
32,Respect the Ray (Freedom Fighters: The Ray/Arrowverse),https://redd.it/9xq91c
33,Respect Beebo (Legends of Tomorrow/Arrowverse),https://redd.it/8hq7cu
34,Respect Superman (CW's Arrowverse),https://redd.it/a6ac1l
35,Respect Angel (The Buffyverse),https://redd.it/9b6ajc
36,Respect Buffy Summers (The Buffyverse),https://redd.it/8ec1hg
38,Respect Luke (Buffy the Vampire Slayer),https://redd.it/534v5l
40,Respect The 10th Doctor (Doctor Who),https://redd.it/663fvo
41,"Respect Grant Gordon, the Ghost (Doctor Who) (Whoniverse)",https://redd.it/aztxwl
42,Respect Heather/Space Oil (Doctor Who),https://redd.it/6pyl4u
43,Respect Jenny (Doctor Who),https://redd.it/67ztxo
44,Respect the Nightmare in Silver Cybermen (Doctor Who) (Whoniverse),https://redd.it/atqwli
45,Respect the Supremacy of the Cybermen Cybermen (Doctor Who) (Whoniverse),https://redd.it/atw2k3
46,"Respect Terui Ryu, Kamen Rider Accel [Kamen Rider W]",https://redd.it/3iuujq
47,Respect Jin Takayama (Kamen Rider Amazons),https://redd.it/9bd9wc
48,Respect Haruka Mizusawa (Kamen Rider Amazons),https://redd.it/9atncl
50,Respect Chase (Kamen Rider Drive),https://redd.it/6yqg1s
55,"Respect Kouta Kazuraba, Kamen Rider Gaim (Kamen Rider Gaim)",https://redd.it/pjm9ap
52,Respect Emu Hojo (Kamen Rider Ex-Aid),https://redd.it/93ixvp
53,Respect Tenjuro Banno/Gold Drive(KR Drive Series Finale),https://redd.it/3nhlxp
54,Respect Kamen Rider Drive,https://redd.it/6ypkh8
56,Respect Kazumi Sawatari and The Hokuto Trio/Crows (Kamen Rider Build),https://redd.it/a2j1jc
57,Respect Takeshi Hongo (Kamen Rider The First/The Next),https://redd.it/65zhvr
59,Respect: Kamen Rider Kabuto,https://redd.it/27zsiu
60,Respect Kamen Rider Mach (Kamen Rider Drive),https://redd.it/6yq6ba
62,Respect Mashin Chaser & The Roidmudes(KR Drive Series),https://redd.it/3ma7aq
63,Respect the Namba Heavy Industries (Kamen Rider Build),https://redd.it/atzywm
64,Respect Riderman (Kamen Rider V3),https://redd.it/6a47nz
65,Respect Black Bolt (Inhumans/Marvel Cinematic Universe),https://redd.it/b300qx
66,Respect Eli Morrow [Agents of SHIELD],https://redd.it/72i9b4
67,Respect Hive (Agents of SHIELD),https://redd.it/augbhq
68,Respect Agent Peggy Carter (Marvel Cinematic Universe),https://redd.it/3x6b8m
69,Respect Quake / Daisy Johnson (Agents of S.H.I.E.L.D),https://redd.it/4h1whx
70,Respect Madame Masque! (Marvel's Agent Carter),https://redd.it/48riuu
71,Respect Kiri and Ankha! (Mortal Kombat: Conquest),https://redd.it/bia7sx
72,Respect Noob Saibot! (Mortal Kombat: Conquest),https://redd.it/aum0bb
73,Respect Raiden! (Mortal Kombat: Conquest),https://redd.it/amqmf0
74,Respect Braun Strowman (WWE),https://redd.it/8493k8
75,"Respect the `"Hardcore Legend`" Mick Foley! (Three Faces of Foley) (WWF/E)",https://redd.it/a820ur
76,"Respect The Deadman, The Undertaker! (WWE)",https://redd.it/6243eo
78,Respect Bibleman (Bibleman),https://redd.it/4kwa5e
79,Respect Black Lightning (Black Lightning),https://redd.it/8ha30b
80,Respect Thunder (Black Lightning),https://redd.it/8ha36n
81,"Respect Broken Matt and Brother Nero, The Broken Hardys! (Broken Universe)",https://redd.it/6kkspi
82,Respect Prue Halliwell (Charmed),https://redd.it/azo470
83,Respect Cyborg (DC Universe),https://redd.it/awxc0a
84,Respect Robin (DC Universe),https://redd.it/axcw9u
85,Respect Jeremiah E. Connery! (Econ and Me),https://redd.it/6c15b3
86,Respect The Flash (1990-91),https://redd.it/5uw3h6
87,Respect Gregor Clegane (Game of Thrones),https://redd.it/5dqlfb
88,Respect Kouga Saejima (Garo) (Slight NSFW),https://redd.it/a4tej9
89,Respect The Biggles (Kidsongs TV Show),https://redd.it/6axyqh
90,Respect Robbie Rotten (Lazy Town),https://redd.it/9akbw5
91,Respect Sportacus (LazyTown),https://redd.it/4vnhvw
92,Respect Merlin! (2008 TV series),https://redd.it/b3ql9r
93,Respect Superhoodie (MisFits),https://redd.it/2m7zf0
94,Respect Casey Bowman (Ninja),https://redd.it/7qpn8w
77,Respect Adam West's Batman (Batman 1960's Television Series),https://redd.it/df23yo
49,Respect Sento Kiryu/Kamen Rider Build (Kamen Rider Build) Redux!,https://redd.it/hqbo4c
51,Respect Ryuga Banjo/Kamen Rider Cross-Z (Kamen Rider Build) Redux!,https://redd.it/hykyhg
61,Respect Gentoku Himuro/Kamen Rider Rogue (Kamen Rider Build)!,https://redd.it/jgyr1p
95,Respect Michael Scarn (The Office),https://redd.it/6a0mv0
96,Respect Mose Schrute (The Office),https://redd.it/7qmaxf
98,Respect Team Machine (Person of Interest),https://redd.it/4pq9yz
99,"Respect the King of Dong Style, Joey Ryan (Pro wrestling)",https://redd.it/9ebc6g
100,Respect Tommy Oliver (Power Ranger),https://redd.it/89ct5t
101,Respect Bill Brasky (Saturday Night Live),https://redd.it/60jh7l
102,Respect David S. Pumpkins! (Saturday Night Live),https://redd.it/79ztm6
104,Respect the Kull Warriors (Stargate SG-1),https://redd.it/4q4uhg
105,"Respect Q, of the Q Continuum (Star Trek)",https://redd.it/2s7l6n
106,Respect Jamison Teague (Strike Force 3: The Reckoning),https://redd.it/5n4fx3
107,Respect Japanese Spider-Man! (Supaidāman),https://redd.it/6zoqnw
108,Respect Dean Winchester (Spoilers up to season 9 finale of Supernatural),https://redd.it/2da4dp
109,Respect Shane and David! (The Upside-Down Show),https://redd.it/6iqj3y
110,Respect Electro (The Amazing Spider-Man 2),https://redd.it/btk9d1
111,Respect The Green Goblin (The Amazing Spider-Man 2),https://redd.it/btkcju
112,Respect The Lizard (The Amazing Spider-Man),https://redd.it/btscns
113,Respect The Amazing Spider-Man (Andrew Garfield),https://redd.it/66qyax
114,Respect Bullseye (Daredevil 2003),https://redd.it/ax3a2u
115,Respect Daredevil (Daredevil 2003),https://redd.it/ax38sh
116,Respect Elektra (Daredevil 2003/Elektra 2005),https://redd.it/azi47t
117,Respect the Elite Members of the Hand (Elektra 2005),https://redd.it/azi6fd
118,Respect Aquaman (DC Extended Universe),https://redd.it/bfujou
119,Respect Batman (DC Extended Universe),https://redd.it/7yjuqi
120,Respect Black Manta (DC Extended Universe),https://redd.it/bg7s56
121,Respect Deadshot (DC Extended Universe),https://redd.it/5zyx2d
122,Respect DOOMSDAY (DC Extended Universe),https://redd.it/8yby7f
123,Respect The Justice League (DC Extended Universe),https://redd.it/7yjuz6
124,Respect Katana (DC Extended Universe),https://redd.it/68cjor
125,Respect Mera (DC Extended Universe),https://redd.it/bg817b
126,Respect Ocean Master (DC Extended Universe),https://redd.it/bg7g81
127,Respect Panda Man [DC Extended Universe],https://redd.it/68bh0o
128,Respect STEPPENWOLF (DC Extended Universe),https://redd.it/8z1o0f
129,Respect The Suicide Squad (DC Extended Universe),https://redd.it/7na8ka
130,Respect Superman (DC Extended Universe),https://redd.it/7yjuem
131,"Respect Diana, Wonder Woman (DC Extended Universe)",https://redd.it/7yjuqk
132,Respect General Zod ! (DC EXTENDED UNIVERSE),https://redd.it/90hsgu
133,Respect Brian O'Conner (The Fast and Furious),https://redd.it/6ci5qd
135,Respect Dominic Toretto (The Fast and the Furious),https://redd.it/6dauki
137,Respect Agent Zero (X-Men Origins: Wolverine),https://redd.it/9367yt
138,Respect Ajax (FOX),https://redd.it/50ibcn
139,Respect Angel Dust (Fox),https://redd.it/622dgx
140,Respect Cable (FOX X-Men),https://redd.it/bhx29e
141,Respect Callisto (X-Men: The Last Stand),https://redd.it/bzgpqq
144,"Respect Wade Wilson, AKA Deadpool (X-Men Origins: Wolverine)",https://redd.it/93rdyj
145,Respect Domino (FOX X-Men),https://redd.it/bhx3hp
146,Respect Firefist (FOX X-Men),https://redd.it/bhx4eh
147,"Respect Remy LeBeau, AKA Gambit (X-Men Origins: Wolverine)",https://redd.it/93gq74
148,Respect Havok (Fox),https://redd.it/5w8alv
149,Respect Iceman (FOX X-Men),https://redd.it/bx2al0
150,Respect Juggernaut (Deadpool 2),https://redd.it/b7ozlp
151,Respect The Juggernaut (X-Men: The Last Stand),https://redd.it/5so43m
152,"Respect Erik Lehnsherr, Magneto (Fox)",https://redd.it/7mhz6n
153,Respect Negasonic Teenage Warhead (FOX Marvel),https://redd.it/c1hcy1
136,Respect Luke Hobbs! (The Fast & The Furious),https://redd.it/luw60u
155,Respect Pyro (X-Men films),https://redd.it/bzw231
156,Respect Sebastian Shaw (FOX),https://redd.it/7o8wor
157,Respect Sabretooth (X-Men films),https://redd.it/b892o2
159,Respect X23-23 (Fox),https://redd.it/7aecm6
160,Respect X-24 (FOX),https://redd.it/6dolbs
161,Respect Yukio (The Wolverine),https://redd.it/c9ja81
162,Respect Yuriko Oyama (X2: X-Men United),https://redd.it/bd56zf
163,Respect Barugon: Gamera,https://redd.it/4vbyqs
164,Respect Heisei Gamera: The Gamera Trilogy,https://redd.it/4v37ti
165,Respect Guiron (Gamera vs Guiron),https://redd.it/ata1cb
166,Respect the Gyaos (Heisei Gamera Trilogy),https://redd.it/93meei
167,Respect Iris: Gamera,https://redd.it/84a6dz
168,Respect Jiger: Gamera,https://redd.it/4vq1iu
169,Respect the Legion: Gamera,https://redd.it/820gyd
170,Respect the Godzilla Universe,https://redd.it/a8oy4n
171,Respect Anguirus! [Godzilla],https://redd.it/3e4dfe
172,Respect Anguirus (Godzilla: Final Wars),https://redd.it/aee2yz
173,Respect Biollante (Godzilla),https://redd.it/819dei
174,Respect Dagahra (Rebirth of Mothra),https://redd.it/8mnv3y
175,Respect Desghidorah (Mothra Trilogy),https://redd.it/8e8ghm
176,Respect Ebirah (Godzilla: Final Wars),https://redd.it/aedyba
177,"Respect the Gargantuas! (Godzilla, Showa)",https://redd.it/bmd3wm
178,"Respect Gezora! (Godzilla, Showa)",https://redd.it/bzjevn
154,Respect Psylocke (Fox),https://redd.it/dzsapq
143,Respect Deadpool! (FOX X-Men),https://redd.it/n00yxy
158,"Respect Wolverine (Fox, X-Men)",https://redd.it/oir8zw
142,Respect Cyclops (X-Men films),https://redd.it/hblv8n
179,Respect Gigan (Godzilla),https://redd.it/8wb8fi
180,Respect Godzilla (1954),https://redd.it/8vf0lx
181,"Respect! `"The King Of Monsters`" Godzilla(Composite)",https://redd.it/2e80st
182,Respect Godzilla (Heisei Era),https://redd.it/c4gyuv
184,Respect Godzilla (Shin Godzilla),https://redd.it/72rgws
185,Respect Godzilla (Showa Era),https://redd.it/6p2inz
186,Respect Gorosaurus (Godzilla),https://redd.it/8h9d4e
187,Respect Hedorah (Godzilla),https://redd.it/88vttj
188,Respect Jet Jaguar (Godzilla),https://redd.it/a9aqb7
189,Respect Kamacuras! (Godzilla),https://redd.it/5v9817
190,Respect King Caesar: Godzilla,https://redd.it/4wnmce
191,Respect King Ghidorah (Godzilla),https://redd.it/8jyeg6
192,Respect King Kong (Godzilla),https://redd.it/bmmp94
193,Respect Kiryu (Godzilla),https://redd.it/8e51g5
194,Respect Kumonga (Godzilla),https://redd.it/8j8o5h
195,Respect M11 (Godzilla vs King Ghidorah),https://redd.it/afx4g4
196,Respect Mechagodzilla(Heisei): Godzilla,https://redd.it/87e5wr
197,Respect Mechagodzilla (Showa) (Godzilla),https://redd.it/8d12a7
198,Respect Mechani-Kong (King Kong Escapes),https://redd.it/bmmoy4
199,Respect Megaguirus (Godzilla),https://redd.it/89k0kn
200,Respect Megalon (Godzilla),https://redd.it/8dspla
201,Respect Minilla (Godzilla),https://redd.it/5a2hzz
202,Respect MOGUERA: Godzilla,https://redd.it/83agbb
203,Respect Monster X (Godzilla),https://redd.it/4n22vy
204,Respect Mothra (Godzilla: Final Wars),https://redd.it/aesoqr
205,"Respect Mothra! (Godzilla, Heisei)",https://redd.it/asjw9q
206,Respect Mothra Leo (Mothra Trilogy),https://redd.it/4ypqkv
207,"Respect Mothra! (Godzilla, Showa)",https://redd.it/958mcs
208,Respect Orga (Godzilla),https://redd.it/83jwgy
209,Respect Rodan (Godzilla: Final Wars),https://redd.it/aee11h
210,Respect Shinichi Ozaki (Godzilla: Final Wars),https://redd.it/aedvvj
211,Respect SpaceGodzilla (Godzilla),https://redd.it/7yymv1
212,Respect Titanosaurus (Godzilla),https://redd.it/802ntp
213,Respect Zilla (Godzilla: Final Wars),https://redd.it/aee4uf
214,Respect Hellboy (2004/2008),https://redd.it/5sc8rf
215,Respect Karl Ruprecht Kroenen (Hellboy film),https://redd.it/a1f6nc
216,Respect Liz Sherman (Hellboy films),https://redd.it/a1qch2
217,Respect Prince Nuada (Hellboy II: The Golden Army),https://redd.it/a219ph
218,Respect The Indominus Rex (Jurassic World),https://redd.it/66f0r7
219,Respect the Indoraptor (Jurassic World: Fallen Kingdom),https://redd.it/asq3xm
220,Respect Owen Grady (Jurassic World),https://redd.it/a8qknu
221,Respect the Spinosaurus (Jurassic Park III),https://redd.it/a8fq2v
222,Respect Stiggy (Jurassic World: Fallen Kingdom),https://redd.it/a8y1e2
223,Respect the Tyrannosaurus Rex! (Jurassic Park),https://redd.it/6s2tvu
225,Respect Gogo Yubari (Kill Bill),https://redd.it/61nsma
226,Respect Pai Mei! [Kill Bill],https://redd.it/497owp
227,"Respect the Beast, the World's Top Killer! [Kung Fu Hustle]",https://redd.it/40k7yx
228,Respect Pig Sty Alley! [Kung Fu Hustle],https://redd.it/40jzuv
229,Respect Sing! [Kung Fu Hustle],https://redd.it/40k9n8
230,"Respect Emil Blonsky, The Abomination (Marvel Cinematic Universe)",https://redd.it/5zsuh0
231,Respect Algrim [Thor: The Dark World],https://redd.it/79yku8
238,"Brock Rumlow, Crossbones (Marvel Cinematic Universe)",https://redd.it/643r0w
224,Respect the Deadly Viper Assassination Squad (Kill Bill),https://redd.it/lchf05
233,Respect the Avengers (Marvel Cinematic Universe),https://redd.it/p3px68
241,Respect Ego (Marvel Cinematic Universe),https://redd.it/bpx3v8
183,Respect Godzilla (Millennium Era),https://redd.it/r9f8e5
248,"Respect Obadiah Stane, The Iron Monger (Marvel Cinematic Universe)",https://redd.it/64drko
251,Respect Loki (Marvel Cinematic Universe),https://redd.it/m3c4in
240,Respect Ebony Maw (Marvel Cinematic Universe),https://redd.it/m62njo
252,"Respect Aldrich Killian, The Mandarin (Marvel Cinematic Universe)",https://redd.it/64dr6d
253,Respect Miscellaneous Animals of the MCU (Marvel Cinematic Universe),https://redd.it/8mmfvw
254,Respect Nebula (Marvel Cinematic Universe),https://redd.it/6t4405
257,Respect Ronan The Accuser (Marvel Cinematic Universe),https://redd.it/5z0zm8
258,Respect The Revengers (Marvel Cinematic Universe/Thor: Ragnarok),https://redd.it/9rwjk3
259,Respect Sif (Marvel Cinematic Universe),https://redd.it/7lxx9e
247,"Respect Tony Stark, Iron Man (Marvel Cinematic Universe)",https://redd.it/j0seun
249,Respect Korath the Pursuer (Marvel Cinematic Universe),https://redd.it/jb3l4o
244,"Respect Clint Barton, Hawkeye (Marvel Cinematic Universe)",https://redd.it/jenhf4
243,Respect the Guardians of the Galaxy (Marvel Cinematic Universe),https://redd.it/jheovu
235,"Respect Natasha Romanoff, the Black Widow (Marvel Cinematic Universe)",https://redd.it/k3atxb
239,Respect Dormammu (Marvel Cinematic Universe),https://redd.it/k4bgz6
246,Respect the Infinity Stones (Marvel Cinematic Universe),https://redd.it/k79y89
250,Respect Korg and Miek (Marvel Cinematic Universe),https://redd.it/klm9vv
232,Respect the Ancient One (Marvel Cinematic Universe),https://redd.it/kmx7s5
260,Respect the Shocker! (MCU),https://redd.it/atm8ls
261,Respect Spider-Man (Marvel Cinematic Universe),https://redd.it/9bajx9
262,Respect Surtur (Thor: Ragnarok/Marvel Cinematic Universe),https://redd.it/9ly7py
265,Respect Ultron (Marvel Cinematic Universe),https://redd.it/7zmrbj
266,Respect Ulysses Klaue (Marvel Cinematic Universe),https://redd.it/a4d9vi
267,"Respect Brunnhilde, Valkyrie (Marvel Cinematic Universe)",https://redd.it/82q2ne
269,"Respect Adrian Toomes, The Vulture (Marvel Cinematic Universe)",https://redd.it/7ni0zb
312,Respect Maul (Star Wars Canon),https://redd.it/n4uzck
272,Respect the Warriors Three (Marvel Cinematic Universe),https://redd.it/9nehv6
273,"Respect Ivan Antonovich Vanko, Whiplash (Marvel Cinematic Universe)",https://redd.it/64drfx
275,Respect The Agents (The Matrix),https://redd.it/8f23ue
276,Respect Agent Smith (The Matrix),https://redd.it/8f23ay
277,Respect Morpheus (The Matrix),https://redd.it/8f23ic
278,Respect Neo (The Matrix),https://redd.it/8f22uo
279,Respect Trinity (The Matrix),https://redd.it/8f23mj
270,Respect Scarlet Witch (Marvel Cinematic Universe),https://redd.it/plmqw0
281,Respect Kong (Kong: Skull Island) [MonsterVerse],https://redd.it/aggchu
282,Respect the MUTO (Godzilla) [Monsterverse],https://redd.it/a50uye
283,Respect the Skullcrawlers (Kong: Skull Island) [MonsterVerse],https://redd.it/b0ooqc
268,Respect Vision (Marvel Cinematic Universe),https://redd.it/q6lvhv
286,Respect Tim the Enchanter (Monty Python and the Holy Grail/Spamalot),https://redd.it/ci92q4
287,Respect Mewtwo (Pokemon Detective Pikachu),https://redd.it/cdr14q
288,Respect Ms. Norman (Pokemon Detective Pikachu),https://redd.it/cdr4dp
289,Respect Pikachu (Pokemon Detective Pikachu),https://redd.it/cdr0ie
290,Respect King Kong (Ready Player One) [Film],https://redd.it/a84ji0
291,Respect Mechagodzilla (Ready Player One) [Film],https://redd.it/9z6kqn
292,Respect the RX-78-2 Gundam (Ready Player One) [Film],https://redd.it/9z6q6c
293,Respect Team Evil [Shaolin Soccer],https://redd.it/497mu7
294,Respect Team Shaolin [Shaolin Soccer],https://redd.it/496ouh
295,Respect Sing! [Shaolin Soccer],https://redd.it/496ib7
296,Respect The Commander (Sky High),https://redd.it/5t3ehv
297,Respect Warren Peace (Sky High),https://redd.it/602fbj
298,Respect Will Stronghold (Sky High),https://redd.it/602ely
302,Respect Spider-Man (Raimi Trilogy),https://redd.it/o4tnq6
301,Respect Harry Osborn (Raimiverse),https://redd.it/aewqr2
303,Respect Venom (Spider-Man 3),https://redd.it/97od24
304,Respect Aayla Secura (Star Wars Canon),https://redd.it/7s8oz3
306,The Ultimate Canon Anakin Skywalker Respect Thread,https://redd.it/5e3moq
307,Respect Barriss Offee [Star Wars Canon],https://redd.it/726lmh
308,Respect Boba Fett (Star Wars Canon),https://redd.it/bm64s2
309,Respect Chewbacca (Star Wars Canon),https://redd.it/bl07du
310,Respect Chirrut Îmwe! (Star Wars),https://redd.it/aidvbx
311,Respect Count Dooku (Star Wars),https://redd.it/6l184l
316,Respect FN-2199 (Star Wars: The Force Awakens),https://redd.it/7qhuy3
317,Respect General Grievous (Star Wars Canon),https://redd.it/b489p3
318,Respect Jango Fett (Star Wars),https://redd.it/af0t7h
320,Respect K-2SO (Rogue One: A Star Wars Story),https://redd.it/63f2qs
321,Respect Kit Fisto (Star Wars Canon),https://redd.it/86ugf8
322,Respect Luke Skywalker (Star Wars),https://redd.it/apava1
323,Respect Luminara Unduli (Star Wars Canon),https://redd.it/80zpqe
324,Respect Mace Windu (Star Wars Canon),https://redd.it/845ye9
325,Respect Obi-Wan Kenobi (Star Wars),https://redd.it/5nkclp
326,Respect Plo Koon (Star Wars Canon),https://redd.it/88k5dr
327,Respect Yoda (Star Wars Canon),https://redd.it/865eaw
328,"Respect The Terminatrix, T-X (Terminator)",https://redd.it/65fei4
329,Respect The T-800 (Terminator),https://redd.it/66030l
330,Respect The T-850 (Terminator),https://redd.it/65s2cv
331,Respect The T-1000 (Terminator),https://redd.it/65n3a4
332,Respect The T-3000 (Terminator),https://redd.it/6501q4
333,Respect Cade Yeager (Transformers Films),https://redd.it/ade023
334,Respect Cogman (Transformers: The Last Knight),https://redd.it/acq8hx
335,Respect the Dinobots (Transformers Films),https://redd.it/addjgb
336,Respect the Guardian Knights (Transformers: The Last Knight),https://redd.it/adbowc
337,Respect Lockdown (Michael Bay Transformers Movies),https://redd.it/6ltyub
338,Respect Megatron (Michael Bay Transformers Movies),https://redd.it/8n4wof
339,Respect Optimus Prime (Michael Bay's Transformers),https://redd.it/acx0y8
284,Respect the Black Knight [Monty Python and the Holy Grail],https://redd.it/cj79y0
285,Respect King Arthur [Monty Python and the Holy Grail],https://redd.it/cjntxm
280,"Respect Godzilla, King of the Monsters (Godzilla) [Monsterverse]",https://redd.it/cwi5k1
319,Respect Jar Jar Binks! (Star Wars Canon),https://redd.it/drji6o
299,Respect Dr. Octopus (Spider-Man 2),https://redd.it/ge2rjy
305,Respect Adi Gallia (Star Wars Canon),https://redd.it/g384mr
271,"Respect James Rhodes, War Machine (Marvel Cinematic Universe)",https://redd.it/j5li6e
313,Respect Sheev Palpatine (Star Wars Canon),https://redd.it/jgx4y2
274,"Respect Bucky Barnes, the Winter Soldier (Marvel Cinematic Universe)",https://redd.it/jqbp76
263,Respect Thanos (Marvel Cinematic Universe),https://redd.it/k7uesx
340,Respect Starscream (Micheal Bay Transformers Movies),https://redd.it/56d5kf
341,Respect the Ultraman Universe,https://redd.it/6o4eez
342,Respect Ace Killer: Ultraman,https://redd.it/6az633
343,Respect Alien Empera: Ultraman,https://redd.it/6caf9b
344,Respect Alien Mefilas: Ultraman,https://redd.it/68i1q7
345,Respect Alien Temperor: Ultraman,https://redd.it/6w2zvp
346,Respect Bemstar: Ultraman,https://redd.it/67t1p8
347,Respect Birdon: Ultraman,https://redd.it/6piuzb
348,Respect Black King (Ultraman),https://redd.it/91cz62
349,Respect Doragory (Ultraman),https://redd.it/9kt07y
350,Respect Galactron: Ultraman,https://redd.it/6igd5s
351,Respect Galberos: Ultraman,https://redd.it/6ppcc2
352,Respect Gargorgon: Ultraman,https://redd.it/6ri5sv
353,Respect Gatanozoa: Ultraman,https://redd.it/73cks5
354,Respect Greeza: Ultraman,https://redd.it/6qd3x4
355,Respect Horoboros (Ultraman),https://redd.it/apoo6w
356,Respect Jugglus Juggler: Ultraman,https://redd.it/79ettz
357,Respect Kei Fukuide and the Belial Fusion Beasts (Ultraman),https://redd.it/8rw363
358,Respect King Joe: Ultraman,https://redd.it/5u3rn7
359,Respect The One: Ultraman,https://redd.it/6nwtk3
360,Respect Red King (Ultraman),https://redd.it/95rx6d
361,Respect Rei's Gomora: Ultraman,https://redd.it/5swqk4
362,Respect Telesdon (Ultraman),https://redd.it/9g4b9u
363,Respect Tyrant: Ultraman,https://redd.it/70cwl2
364,Respect Ultraman: Ultraman,https://redd.it/62i0n2
365,Respect Ultraman Belial: Ultraman,https://redd.it/5v0tu7
366,Respect Ultraman Geed: Ultraman,https://redd.it/7ndjep
367,Respect Ultraman Leo (Ultraman),https://redd.it/8lyp2j
368,Respect Ultraman Orb: Ultraman,https://redd.it/6fiobp
369,Respect Ultraman Orb Dark Noir Black Schwarz (Ultraman),https://redd.it/ayvnvm
370,Respect Ultraman Zero: Ultraman,https://redd.it/5yuozz
371,Respect Verokron: Ultraman,https://redd.it/6uc4e7
372,"Respect Zetton, the Space Dinosaur: Ultraman",https://redd.it/5wcatg
373,"Respect David Dunn, The Overseer (Unbreakable Trilogy)",https://redd.it/bcciyg
374,"Kevin Wendell Crumb, The Horde (Unbreakable Trilogy)",https://redd.it/bccj18
375,[Respect] The Ymir (20 Million Miles to Earth),https://redd.it/69irzm
376,"[Respect] `"Robattalion`" (A.I. Assault / Shockwave)",https://redd.it/8rcz4l
377,Respect Abraham Lincoln! (Abraham Lincoln: Vampire Hunter),https://redd.it/60l2qk
378,Respect Christian Wolff (The Accountant),https://redd.it/5vkoku
379,Respect Robin Hood (The Adventures of Robin Hood 1938),https://redd.it/6wmy4k
380,Respect Private Vasquez (Aliens),https://redd.it/6q8f3z
381,Respect the Canon Xenomorphs (Alien),https://redd.it/5ufshw
382,Respect the Predalien (Aliens vs Predator: Requiem),https://redd.it/8pg96x
383,Respect Henry Howard (The Amazing Bulk),https://redd.it/67yp56
384,Respect Nie Yinniang (The Assassin),https://redd.it/5b6ajy
385,Respect Nancy Archer (Attack of the 50 Ft. Woman),https://redd.it/7033j9
386,"Respect Austin Powers, the International Man of Mystery! (Austin Powers)",https://redd.it/64m3jd
387,Respect Batman! [Michael Keaton],https://redd.it/54hrjc
389,Respect Matt Brody (Baywatch 2017),https://redd.it/78s781
390,"[Respect] The Rhedosaurus (The Beast from 20,000 Fathoms)",https://redd.it/68po2i
391,Respect Black Dynamite!,https://redd.it/5nvet1
392,Respect Officer K (Blade Runner: 2049),https://redd.it/8yftd9
393,Blade (Blade Trilogy films),https://redd.it/5czzjx
394,Respect the Blair Witch (Blair Witch mythos),https://redd.it/9m805w
396,Respect Carrie White (Carrie 2013),https://redd.it/5zt04r
397,The Russian Blue(Cats And Dogs 2001),https://redd.it/a8b6gk
398,Respect Catwoman (Catwoman),https://redd.it/brrmdc
399,Respect Gabe Walker (Cliffhanger),https://redd.it/5pekc3
400,Respect The Cloverfield Monster (Cloverfield),https://redd.it/7w9ps8
401,"Respect Lt. Marion `"Cobra`" Cobretti (Cobra)",https://redd.it/5p0shx
402,Respect John Matrix (Commando),https://redd.it/5dyvzb
403,Respect: Bruce Lee,https://redd.it/2paoj5
404,Respect Balthazar (Constantine),https://redd.it/780xnr
405,Respect Annabelle the Doll (The Conjuring Universe),https://redd.it/8znvrp
406,Respect Caleb Danvers (The Covenant),https://redd.it/50q1cw
407,Respect Chev Chelios! [Crank/Crank 2: High Voltage],https://redd.it/69ps8b
408,Respect Prince Jai (Curse Of The Golden Flower),https://redd.it/5ype7y
409,Respect I.S.A.A.C. (Cyborg Soldier),https://redd.it/684rrr
410,Respect Daimajin (Daimajin),https://redd.it/8jyjyg
411,"Respect Roland Deschain, The Gunslinger (The Dark Tower - Film)",https://redd.it/78216c
412,"Respect Walter, The Man in Black (The Dark Tower - Film)",https://redd.it/7821qh
413,Respect Dinoshark (Dinoshark),https://redd.it/5w0ncw
414,Respect the Man with No Name! (Dollars Trilogy),https://redd.it/6hv9yh
415,Respect Aaron Brand (Double Down),https://redd.it/4oh38b
417,Respect Dracula (Dracula Untold),https://redd.it/5dvxev
