id,title,link
5515,Respect Tatsuo Shinada (Yakuza),https://redd.it/71gj9l
5516,Respect The Tojo Clan (Yakuza),https://redd.it/7qo44t
5517,Respect Hat Kid! (A Hat In Time),https://redd.it/abd8r5
5518,Respect Abobo! (Abobo's Big Adventure),https://redd.it/71e233
5519,Respect Shelly de Killer (Ace Attorney),https://redd.it/8z6jqe
5520,"Respect Lieutenant Linn Kurosawa (Alien vs Predator video game, 1994)",https://redd.it/3qqe9q
5521,Respect Alice Liddell! (American McGee's Alice),https://redd.it/67ky7r
5522,Respect the Freaky Monkey Five! [Ape Escape],https://redd.it/3ykufv
5523,Respect Satoru and Sayaka! [Ape Escape],https://redd.it/3ykly2
5524,Respect Joey! [Arcade America],https://redd.it/45njof
5525,Respect Ezio Auditore da Firenze! (Assassin's Creed),https://redd.it/6y1bws
5526,Respect Giovanni Auditore (Assassin's Creed),https://redd.it/5mu573
5527,Respect Baldi and his friends (Baldi's Basics),https://redd.it/8t0q3k
5528,Respect Balloon Fighter (Balloon Fight),https://redd.it/ajlxwz
5529,Respect Banjo and Kazooie! (Banjo-Kazooie),https://redd.it/5biazv
5530,"Respect Charles Barkley! (Barkley, Shut Up and Jam: Gaiden)",https://redd.it/bpu53a
5531,Respect The Kid (Bastion),https://redd.it/3odagy
5533,Respect Killer Croc [Arkhamverse],https://redd.it/54hfzx
5534,Respect Peak Battlefield 4 Soldier (Battlefield),https://redd.it/53aojm
5535,"Respect The Umbra Witch, Bayonetta",https://redd.it/3d5o3f
5536,Respect Jodie Holmes & Aiden (Beyond Two Souls),https://redd.it/3ohf74
5537,Respect Isaac! (The Binding of Isaac),https://redd.it/5ll8cc
5538,Respect the Black Baby (Black Baby),https://redd.it/b2m60r
5539,Respect Stella (Black★Rock Shooter: THE GAME),https://redd.it/3li697
5540,Respect the Hunter (Bloodborne),https://redd.it/6n61vy
5487,Respect Heihachi Mishima (Tekken),https://redd.it/pdeswd
5541,Respect Lady Maria of the Astral Clocktower! (Bloodborne),https://redd.it/75yc2o
5542,Respect Bomberman! [Bomberman],https://redd.it/3eefxn
5543,Respect Eddie Riggs! (Brütal Legend),https://redd.it/511waq
5544,Respect Bubsy (Bubsy the Bobcat),https://redd.it/c0mabn
5545,Respect Russell Northrop (Bully),https://redd.it/7xwvs3
5546,"Respect Tank Dempsey, Nikolai Belinski, Takeo Masaki and Edward Richtofen! (Call of Duty:Nazi Zombies)",https://redd.it/66satu
5548,Respect Christopher Belmont! (Castlevania),https://redd.it/97odgp
5549,Respect Simon Belmont (Castlevania),https://redd.it/96svw6
5550,Respect Part of Me (Celeste),https://redd.it/7z7aur
5551,Respect The Siloship (Children of a Dead Earth),https://redd.it/7nr4v7
5552,Respect The Solar Lance (Children of a Dead Earth),https://redd.it/7fop15
5553,Respect Crono and team! (Chrono Trigger),https://redd.it/453vha
5554,Respect The Clash of Clans Troops (Clash of Clans),https://redd.it/4isw88
5555,Respect the A.B.E. (Code Name: S.T.E.A.M.),https://redd.it/4r6901
5556,Respect Ethan Thomas (Condemned),https://redd.it/3sklg7
5557,Respect Conker the Squirrel! [Conker's Bad Fur Day],https://redd.it/4a1gho
5558,Respect Croc! (Croc: Legend of the Gobbos),https://redd.it/bieue6
5559,Respect Prophet/The Nanosuit (Crysis),https://redd.it/61p2ew
5560,Respect King Dice and the King's Court! (Cuphead),https://redd.it/76lgjw
5561,Respect David Young (D4: Dark Dreams Don't Die),https://redd.it/3p5naz
5562,Respect the Prophet! (Darkest Dungeon),https://redd.it/arqo7x
5563,Respect Jackie Estacado! (The Darkness) (Games),https://redd.it/59yomc
5564,Respect Death (Darksiders series),https://redd.it/6xc8fg
5565,Darksiders - Fury,https://redd.it/ad8fn6
5567,Respect Isaac Clarke [Dead Space],https://redd.it/8e7ek7
5568,Respect the Scorpion (Deadly Creatures),https://redd.it/areaqk
5569,Respect the Tarantula (Deadly Creatures),https://redd.it/areant
5570,Respect Keith Norman (Detective Pikachu),https://redd.it/c0act0
5571,Respect Adam Jensen (Deus Ex),https://redd.it/3swym5
5572,"Respect Taizo Hori, Dig Dug! (Dig Dug)",https://redd.it/b75ach
5573,Respect Takumi Aiba (Digimon Story: Cyber Sleuth),https://redd.it/4o3yrg
5574,Respect Captain Jack Hardgrave! (Dino D-Day),https://redd.it/7650zk
5575,Respect Laharl (Disgaea),https://redd.it/6ztga6
5576,Respect Mickey Mouse! (Disney's Epic Mickey),https://redd.it/c1ropr
5578,Emily Kaldwin - Dishonored Franchise,https://redd.it/8h43bw
5579,Respect the Doom Slayer (DOOM 2016),https://redd.it/753ly2
5580,Respect the Dota 2 Universe (Part 1),https://redd.it/36brv1
5581,Respect Janemba(Dragon Ball Z shin budokai),https://redd.it/6zy1g2
5582,Respect Dirk the Daring (Dragon's Lair),https://redd.it/76dhrv
5583,Respect Brother One (Drakengard),https://redd.it/86iy7a
5584,Respect Caim (Drakengard),https://redd.it/86i3md
5585,Respect Dustforce! (Dustforce),https://redd.it/83jitl
5586,Respect Earthworm Jim [Earthworm Jim series],https://redd.it/3o41ry
5587,Respect Ecco (Ecco the Dolphin),https://redd.it/8jl1fo
5588,Respect Queen of Ice (Enchanted Arms),https://redd.it/5j42rz
5589,"Respect Matt, Natalie, Lance, Anna: [Epic Battle Fantasy] main characters",https://redd.it/50u5jf
5590,Respect the Vell-os (Escape Velocity: Nova),https://redd.it/4hy7l4
5591,Respect EVE online!,https://redd.it/3df9jt
5592,Respect the Monsters! (Evolve),https://redd.it/74yuei
5593,Respect Captain Falcon (F-Zero),https://redd.it/84gvyp
5594,Respect Jason Brody,https://redd.it/33vmvb
5595,Respect the Dark Emperor (Find Mii II),https://redd.it/4jjlpi
5596,Respect Apollyon: For Honor,https://redd.it/648qt1
5597,Respect the Playable Characters (Fortnite),https://redd.it/9gehl1
5598,Respect Sergeant Jet Brody! (Fracture),https://redd.it/6xiiml
5599,Respect The Stranger (Furi),https://redd.it/69yd6j
5600,Respect Mr. Game & Watch! (Game & Watch),https://redd.it/b0nyhd
5601,Respect Glover (Glover),https://redd.it/anlafc
5602,Respect Gene! (God Hand),https://redd.it/5w5l1b
5603,"Respect Isaac, the Golden Venus Adept! (Golden Sun Series)",https://redd.it/4mwr2j
5604,Respect Niko Bellic (Grand Theft Auto IV),https://redd.it/4jiu3t
5605,Respect Trevor Phillips (GTA V),https://redd.it/3drn1d
5606,Respect Kat (Gravity Rush),https://redd.it/362yh1
5607,Respect Raven (Gravity Rush),https://redd.it/73czil
5613,Respect Jacket! (Hotline Miami),https://redd.it/pdzjg9
5609,Respect Sol Badguy (Guilty Gear Franchise),https://redd.it/b11tuj
5610,Respect Henry Stickmin (Henry Stickmin),https://redd.it/9gohun
5611,Respect Agent 47 (Hitman),https://redd.it/4vpwog
5612,Respect The Knight (Hollow Knight),https://redd.it/b4lxy5
5614,Respect Sharkjira (Hungry Shark Evolution),https://redd.it/c34qyv
5615,"Respect, The Drifter (Hyper Light Drifter)",https://redd.it/87o864
5616,"Respect Iji Kataiser, the Human Anomaly (Iji)",https://redd.it/3enj6y
5617,Respect Jak and Daxter (Jak and Daxter),https://redd.it/6op65l
5618,Respect Heaven Ascension DIO (Jojo's Bizarre Adventure: Eyes of Heaven),https://redd.it/5l0ie7
5619,Respect Rico Rodriguez! (Just Cause),https://redd.it/b0v0ao
5620,Respect the Smith Syndicate (Killer7),https://redd.it/az0l2x
5621,Respect Mondo Zappa (Killer Is Dead),https://redd.it/7cfwme
5622,Respect King Tongue (King Tongue),https://redd.it/4lz0ab
5623,Respect Knack! (Knack),https://redd.it/77jc4u
5624,[Respect] Cyclop (The Last DeadEnd),https://redd.it/9ot0ar
5547,Respect the Protagonist! (CarnEvil),https://redd.it/nolru5
5626,Respect Starfy! (The Legendary Starfy),https://redd.it/74s4nd
5627,Respect Carnom (LEGO Marvel),https://redd.it/ca7kz7
5628,Respect Stan Lee! (LEGO Marvel),https://redd.it/b27ntj
5629,Respect Larry Laffer! (Leisure Suit Larry),https://redd.it/6q6pfr
5630,Respect Lester (Lester the Unlikely),https://redd.it/5memrt
5631,Respect Max Caulfield (Life is Strange),https://redd.it/3o0hmb
5632,Respect the Black Tiger (Life of Black Tiger),https://redd.it/6oib0w
5633,Respect Sackboy! (LittleBigPlanet),https://redd.it/abc3ht
5635,Respect Buddy! (LISA: The Painful RPG),https://redd.it/b00bm8
5636,Respect Composite Elodie (Long Live the Queen),https://redd.it/3ul31s
5637,Respect Lucius Wagner (Lucius),https://redd.it/3pmyqi
5638,Respect DeathWatch! [MadWorld],https://redd.it/41s6d6
5639,Respect Jack Cayman! (MadWorld),https://redd.it/591lqh
5640,Respect a Magicka Wizard,https://redd.it/3mi64r
5641,Respect Marlow Briggs! (Marlow Briggs and the Mask of Death),https://redd.it/9aidnv
5642,Respect The Imperfects (Marvel Nemesis),https://redd.it/bss9bs
5643,Respect Captain America (Marvel vs Capcom),https://redd.it/br1vdb
5645,"Respect Sir Daniel Fortesque, Hero of Gallowmere! (MediEvil)",https://redd.it/71tsm8
5646,Respect Beck (Mighty No. 9),https://redd.it/axdfvn
5647,"Respect Steve, from Minecraft",https://redd.it/2h02tm
5648,"Respect Steve (Minecraft, Survival Mode)",https://redd.it/bqnnsf
5649,Respect J.J. Macfield! (The Missing: J.J. Macfield and the Island of Memories),https://redd.it/azpvps
5650,Respect the Monsters! (The Missing: J.J. Macfield and the Island of Memories),https://redd.it/azpvp8
5651,Respect Kaho Reinhol (Momodora),https://redd.it/8corjr
5652,Respect Takamaru! (The Mysterious Murasame Castle),https://redd.it/b4riek
5653,Respect 2B! (Nier: Automata),https://redd.it/bqawvm
5654,Respect A2! (Nier: Automata),https://redd.it/bqawuu
5655,Respect Mii!,https://redd.it/2si4fb
5656,Respect Asagi Asagiri (Nippon Ichi),https://redd.it/76xz5t
5657,Respect Destroyman! (No More Heroes),https://redd.it/bhbu5j
5658,Respect Travis Touchdown! [No More Heroes],https://redd.it/4mkiy6
5659,Respect Octodad! (Octodad),https://redd.it/7pbafq
5660,Respect Stranger (Oddworld: Stranger's Wrath),https://redd.it/5mo8q0
5661,Respect The Batter! [OFF],https://redd.it/3xmdgf
5634,Respect Six (Little Nightmares),https://redd.it/m9xhst
5663,Respect One Finger Death-Punch Man! (One Finger Death Punch),https://redd.it/6coe41
5664,Konoko [Oni],https://redd.it/5c3y4o
5665,Respect Chris Walker [Outlast],https://redd.it/5555b8
5666,Respect Pac-Man (Pac-Man),https://redd.it/b7potr
5667,"Respect Ash, The War Machine! (Paladins: Champions of the Realm)",https://redd.it/bqcslt
5668,Respect Terminus (Paladins: Champions of the Realm),https://redd.it/9k34w3
5669,Respect the Payday Gang,https://redd.it/31hthm
5670,Respect Dr. Zomboss (Plants vs. Zombies),https://redd.it/bpikep
5671,Respect the Plants (Plants vs. Zombies: Garden Warfare),https://redd.it/av6ocq
5672,Respect the Zombies (Plants vs. Zombies: Garden Warfare),https://redd.it/avjibx
5673,Respect the PlayStation All-Stars (self-titled),https://redd.it/4kz2rp
5683,"Respect Razputin `"Raz`" Aquato! (Psychonauts)",https://redd.it/pdzd3p
5675,Respect the Snocross Racer! [Polaris Snocross],https://redd.it/44nxbf
5676,Respect Aperture Science (Portal),https://redd.it/akti3d
5677,Respect Edward Falcon! (Power Stone),https://redd.it/avewhh
5678,Respect the Prince of Persia! (Prince of Persia: Sands of Time),https://redd.it/b0giss
5679,Respect Emmy Altava (Professor Layton),https://redd.it/8qwde7
5680,Respect Professor Hershel Layton (Professor Layton),https://redd.it/856fu0
5681,Respect Alex Mercer (Prototype),https://redd.it/9l2qq3
5682,Respect Sergeant James Heller! (Prototype 2),https://redd.it/bvpbji
5684,Respect Pulseman! (Pulseman),https://redd.it/bkqafj
5685,[Respect] Little Mac,https://redd.it/2j43au
5686,[Respect] The Boxers (Punch Out!!) (Wii),https://redd.it/b5pvak
5687,Respect Quake Ranger (Quake),https://redd.it/3yyxrj
5688,Respect George! (Rampage games),https://redd.it/avml2a
5689,Respect Ratchet and Clank! (Ratchet & Clank),https://redd.it/6k2zok
5690,Respect Mr. Dark (Rayman),https://redd.it/ae0a5g
5691,Respect Rayman (Rayman),https://redd.it/b1vtip
5692,Respect The Hero (Red Steel 2),https://redd.it/2kyp8n
5693,Respect The Last Kusagari (Red Steel 2),https://redd.it/44o1l4
5694,Respect Allison Holiday! (Revolution 60),https://redd.it/bvsfg2
5695,Respect Jake Conway! [Ride to Hell: Retribution],https://redd.it/3vp6pw
5696,"Respect the Super Ultra Sexy Hero, Zan! (Rising Zan: The Samurai Gunman)",https://redd.it/74iiv5
5697,"Respect Providence, Bulwark of the Weak (Risk of Rain)",https://redd.it/40bari
5698,Respect: Robloxian [ROBLOX],https://redd.it/2ofgdf
5699,Respect Johnny Gat! [Saint's Row],https://redd.it/4fz7yf
5700,Respect The Boss! (Saints Row),https://redd.it/5hhktv
5701,Respect Sam and Max (Sam and Max),https://redd.it/6uemdt
5702,Respect Maxwell (Scribblenauts),https://redd.it/3xqw6b
5703,"Respect Genesis Valentine, the Living Nightmare. (Second Life)",https://redd.it/65q65o
5704,Respect Barack Obama! (Shaq Fu: A Legend Reborn),https://redd.it/b33rib
5705,Respect Shaq! (Shaq Fu: A Legend Reborn),https://redd.it/8pjyk0
5706,Respect Alice! (Shin Megami Tensei),https://redd.it/8w3ulk
5707,Respect Demi-Fiend (SMT Nocturne),https://redd.it/6jhm28
5674,Respect Shadow Mewtwo (Pokken Tournament),https://redd.it/o65gfu
5711,Respect Marie (Skullgirls),https://redd.it/5uu8th
5712,Respect the Skullgirls Universe,https://redd.it/81x8bj
5713,Respect Wei Shen (Sleeping Dogs),https://redd.it/2o0xy1
5714,"Respect Jormungandr, the World Serpent! (SMITE)",https://redd.it/b00jnh
5715,Respect Karl Fairburne (Sniper Elite),https://redd.it/3rznmz
5716,Respect: Emerel (Sonic Battle),https://redd.it/49m6w0
5717,Respect the Soulcalibur Universe (Original Timeline),https://redd.it/9rgkmr
5719,[Respect] The Spartan (Spartan: Total Warrior),https://redd.it/4629vf
5720,Respect Rick Taylor (Splatterhouse),https://redd.it/4xyobn
5721,Respect the Robo-Bosses! (Spongebob Squarepants: Battle for Bikini Bottom),https://redd.it/c013bh
5722,Respect The Grox! (Spore),https://redd.it/b3x4e6
5723,"Terran Marine, Starcraft",https://redd.it/490y39
5724,Respect Emmett Graves (Starhawk),https://redd.it/7903ny
5726,Respect The Star Wars Chess Universe,https://redd.it/bjn6fe
5727,"Respect: X1, Sith Lord (Star Wars)",https://redd.it/4v60zt
5778,Respect Berserker of Red! (Fate/Apocrypha),https://redd.it/l6ld91
5729,Respect Strider Hiryu! (Strider),https://redd.it/73o4l1
5730,Respect Torque (The Suffering),https://redd.it/ayht2t
5731,Respect The Player (Sunset Overdrive),https://redd.it/3r1qpk
5732,Respect Superhot Guy! (Superhot),https://redd.it/biglf6
5733,Respect Supreme Commanders,https://redd.it/34ydft
5734,Respect Clementine! (Telltale's The Walking Dead),https://redd.it/6vf533
5735,Respect Kenny! (Telltale's The Walking Dead),https://redd.it/6vefm3
5736,Respect The Pomeranian! (Tokyo Jungle),https://redd.it/6dbex6
5738,"Respect Yukari Yakumo, the Youkai of Boundaries! (Touhou)",https://redd.it/9y6eso
5739,Respect Trypticon/Nemesis (Transformers Aligned Continuity),https://redd.it/70x6c8
5740,Respect Red (Transistor),https://redd.it/3ojchu
5741,Respect Calypso (Twisted Metal),https://redd.it/bjb9hi
5742,Respect Sweet Tooth (Twisted Metal),https://redd.it/bo8pid
5743,Respect Nathan Drake (Uncharted),https://redd.it/58wkv0
5744,Respect Wendigos (Until Dawn),https://redd.it/a3lovj
5745,Respect Lammy (Parappa The Rapper [UmJammer Lammy]),https://redd.it/7z003k
5746,Respect Selvaria Bles (Valkyria Chronicles),https://redd.it/6j327x
5747,Respect Sam Gideon (Vanquish),https://redd.it/3hnia8
5748,Respect Vectorman! (Vectorman),https://redd.it/bpdo83
5749,Respect Nightmare Gabe (Video Game Championship Wrestling),https://redd.it/3ozjid
5750,The Visitor (The Visitor),https://redd.it/65l4xb
5751,Respect Voodoo Vince! (Voodoo Vince),https://redd.it/bjbor3
5752,Respect Shadow Stalker (Warframe),https://redd.it/9j2t06
5753,Respect Tenno (Warframe),https://redd.it/62q53c
5754,Respect Grimgor Ironhide (Warhammer Fantasy Battles),https://redd.it/3oafhh
5755,Respect the Ubersreik Five! (Warhammer: Vermintide),https://redd.it/b5ws8o
5757,Respect Rubi Malone (Wet),https://redd.it/3rau3a
5758,"Respect Dettlaff van der Eretein, the Beast of Beauclair! (The Witcher 3: Blood and Wine)",https://redd.it/9h23c5
5759,Respect Geralt of Rivia (The Witcher),https://redd.it/4bdb5u
5760,Respect Bloody Mary (The Wolf Among Us),https://redd.it/br5rhd
5761,Respect Gunslinger Joe (Wolfenstein: The Freedom Chronicles),https://redd.it/c08lcy
5762,Respect Neku Sakuraba! (The World Ends With You),https://redd.it/6nuzti
5763,Respect Sho Minamimoto! (The World Ends With You),https://redd.it/6nuzsc
5764,Respect Yooka and Laylee! (Yooka-Laylee),https://redd.it/6pgjux
5765,Respect Akane Kurashiki (Zero Escape),https://redd.it/5bdxzc
5766,Respect Domovoi Butler (Artemis Fowl),https://redd.it/9j7vqe
5767,Respect Holly Short (Artemis Fowl),https://redd.it/9jj9n2
5768,Respect Mulch Diggums (Artemis Fowl),https://redd.it/9htgof
5769,"Respect Aslan, son of the Emperor-Over-The-Sea (Chronicles of Narnia)",https://redd.it/7sy2s1
5770,"Respect Jadis, the White Witch (Chronicles of Narnia)",https://redd.it/619l4x
5771,Respect Peter Pevensie! (The Chronicles of Narnia Books),https://redd.it/c2izf6
5772,Respect Codex Alera (Part 1),https://redd.it/8ype4r
5773,Respect Codex Alera (Part 2),https://redd.it/8ypja3
5774,Respect the Primary Vord Queen [Codex Alera],https://redd.it/2f3q80
5789,"Respect Kiritsugu Emiya, the Magus Killer! (Fate)",https://redd.it/qhg5e4
5776,Respect Archer of Red (Fate/Apocrypha),https://redd.it/bwh5k5
5777,Respect Assassin of Red (Fate/Apocrypha),https://redd.it/cg23sf
5779,Respect Kairi Sisigou (Fate/Apocrypha),https://redd.it/3aq9qf
5737,Respect Reimu Hakurei (Touhou),https://redd.it/r0ei4c
5783,Respect Ruler (Fate/Apocrypha),https://redd.it/c9her7
5784,Respect Sieg/Saber of Black (Fate/Apocrypha),https://redd.it/bv8hv9
5786,Respect Assassin (Fate/Zero),https://redd.it/3bojhk
5787,Respect Berserker [Fate/Zero],https://redd.it/3nnrc4
5788,Respect Caster (Fate/Zero),https://redd.it/3bldu3
5790,Lancer (Fate/Zero),https://redd.it/2kwvos
5709,Respect Plague Knight (Shovel Knight),https://redd.it/lqp8yt
5756,Respect Aiden Pearce (Watch_Dogs),https://redd.it/m1cbb9
5718,Respect Ulala (Space Channel 5),https://redd.it/mbmjcj
5725,Respect the Arwing (Star Fox),https://redd.it/nbq5a1
5710,Respect Pyramid Head (Silent Hill),https://redd.it/oaac1j
5791,Respect Rider (Fate/Zero),https://redd.it/2jgxti
5793,"Respect Bayaz, the first of the Magi (The First Law)",https://redd.it/8p3dr2
5794,Respect Ferro Maljinn (The First Law),https://redd.it/8j6phz
5795,Respect Logen Ninefingers (The First Law),https://redd.it/7ayubs
5796,Respect Artemis Entreri (Forgotten Realms),https://redd.it/bbnw2r
5797,Respect Athrogate (Forgotten Realms),https://redd.it/chol8w
5798,Respect Drizzt Do'Urden (Forgotten Realms),https://redd.it/9seejz
5799,Respect Grandmaster Kane (Forgotten Realms),https://redd.it/9taw52
5800,Respect Jarlaxle (Forgotten Realms),https://redd.it/bdh9va
5801,Respect King Obould Many-Arrows (Forgotten Realms),https://redd.it/9xf0is
5802,Respect The Crystal Shard (Forgotten Realms),https://redd.it/bdh98g
5803,Respect Thibbledorf Pwent (Forgotten Realms),https://redd.it/chu83l
5804,Respect Tiago Baenre (Forgotten Realms),https://redd.it/chxf2z
5805,Respect Achilles (Greek Mythology),https://redd.it/b613pb
5806,Respect Diomedes! (The Illiad),https://redd.it/6c84za
5807,Respect Hera (Greek Mythology),https://redd.it/5zyq3t
5808,Respect Odysseus! (The Odyssey),https://redd.it/6ccctj
5809,Respect Orpheus! (Greco-Roman Mythology),https://redd.it/a8dnfa
5810,Respect Perseus (Greek Mythology),https://redd.it/7w2ai8
5811,Respect Poseidon (Greek Mythology),https://redd.it/62qc6f
5812,Respect Zeus (Greek Mythology),https://redd.it/5ln76n
5813,Respect Admiral Preston J. Cole (Halo),https://redd.it/2ce4g2
5814,Respect Rtas 'Vadum - the Half-Jaw [Halo],https://redd.it/aseog6
5815,Respect Tem'Bhetek - the Prelate [Halo],https://redd.it/aseo4q
5816,Respect Albus Dumbledore (Harry Potter),https://redd.it/3uamsg
5817,Respect Bellatrix Lestrange! (Harry Potter Books),https://redd.it/ar1psr
5818,Respect Dementors! (Harry Potter Books),https://redd.it/bbbtrx
5819,Respect the Flying Ford Angelia! (Harry Potter Books),https://redd.it/az6qko
5820,Respect Grawp! (Harry Potter Books),https://redd.it/b5cozz
5821,Respect Harry Potter!,https://redd.it/33ldbn
5822,Respect Mad-Eye Moody! (Harry Potter Books),https://redd.it/b8mejf
5823,Respect Professor McGonagall! (Harry Potter Books),https://redd.it/bbqks4
5824,Respect Remus Lupin! (Harry Potter Books),https://redd.it/at3zuh
5825,Respect Rubeus Hagrid! (Harry Potter Books),https://redd.it/asurii
5826,Respect Severus Snape! (Harry Potter Books),https://redd.it/bchjt8
5827,Respect Lord Voldemort [Harry Potter Book Canon],https://redd.it/7xliez
5828,"Respect the Angels of the Lord (Holy Bible, ESV)",https://redd.it/7rjkgr
5829,"YHWH/God (New International Version, Old Testament)",https://redd.it/6ddpaf
5830,Respect Gideon (Holy Bible),https://redd.it/4kh15z
5831,"Respect Jesus Christ, Son of God (Holy Bible, ESV)",https://redd.it/7rjlqt
5832,Respect Jesus in Revelation [ESV],https://redd.it/7tpmbd
5833,Respect the Judges (Holy Bible),https://redd.it/4km6fq
5834,Respect Moses (The Bible / The Torah),https://redd.it/442mn9
5835,Respect Samson (Holy Bible),https://redd.it/4jp4vd
5836,Respect Samuel (Holy Bible),https://redd.it/4k66r1
5837,"Respect The Devil, Deceiver of the Whole World (Holy Bible, ESV)",https://redd.it/7rcod8
5838,Respect Colonel Fedmahn Kassad (Hyperion Cantos),https://redd.it/77ag7n
5839,Respect Rhadamanth Nemes (Hyperion Cantos),https://redd.it/6c0l5t
5840,Respect The Shrike (Hyperion Cantos),https://redd.it/6cp21x
5841,"Respect Durza, The Shade (Inheritance Cycle)",https://redd.it/b9tp1z
5842,Respect Eragon,https://redd.it/2dui4j
5843,Respect Nar Garzhvog! (Inheritance Cycle),https://redd.it/6bdl07
5844,Respect Saphira! (Inheritance Cycle),https://redd.it/bswcut
5845,Respect Esfandiyār! (Iranian Mythology),https://redd.it/b1nbv3
5846,Respect the Manticore! (Iranian Mythology),https://redd.it/b52vtu
5847,Respect Rostam! (Iranian Mythology),https://redd.it/b4bo0h
5848,"Respect The Hound of Culann, Cú Chulainn (The Ulster Cycle)",https://redd.it/665h1q
5849,Respect Diarmuid O'Duibne! (Fenian Cycle),https://redd.it/64k1d3
5850,Respect Fionn mac Cumhaill (The Fenian Cycle),https://redd.it/arr5ja
5851,Respect Eris Greyrat (Mushoku Tensei: Isekai Ittara Honki Dasu | Jobless Reincarnation: It Will Be An All Out If I Go To Another World),https://redd.it/ch889l
5852,Respect Orsted (Mushoku Tensei: Isekai Ittara Honki Dasu | Jobless Reincarnation: It Will Be An All Out If I Go To Another World),https://redd.it/cf7hhg
5853,Respect Rudeus Greyrat (Mushoku Tensei: Isekai Ittara Honki Dasu | Jobless Reincarnation: It Will Be An All Out If I Go To Another World),https://redd.it/ceswfp
5854,Respect the Apis Bull Statue! (The Kane Chronicles),https://redd.it/b9jxfg
5855,Respect Apophis! (The Kane Chronicles),https://redd.it/bguzhs
5856,Respect Carter Kane (Kane Chronicles),https://redd.it/8a8qp4
5857,Respect Sadie Kane! (The Kane Chronicles),https://redd.it/bhbpry
5858,Respect Setne! (The Kane Chronicles),https://redd.it/bgg1fe
5859,Respect Aragorn! (The Lord of the Rings Books),https://redd.it/a8cbkg
5860,Respect Gandalf,https://redd.it/2baay1
5861,Respect Morgoth Bauglir (The Silmarillion),https://redd.it/6x8maa
5862,Respect the Nazgûl (Lotr Trilogy),https://redd.it/6zr5ya
5863,Respect the One Ring (The Lord of the Rings),https://redd.it/aryevq
5864,Respect Samwise Gamgee (Lord of the Rings books),https://redd.it/6faoir
5865,[Respect] Sauron,https://redd.it/2javw8
5866,Respect Smaug! (The Hobbit Book),https://redd.it/aw5ocu
5867,Respect Tom Bombadil (The Lord of the Rings),https://redd.it/bdu65u
5868,Respect Akane (Magical Girl Raising Project),https://redd.it/84x6px
5869,Respect Cherna Mouse (Magical Girl Raising Project),https://redd.it/aenit1
5870,Respect Filuru (Magical Girl Raising Project),https://redd.it/82qvmv
5871,Respect Hardgore Alice (Magical Girl Raising Project),https://redd.it/8fke7f
5872,Respect La Pucelle (Magical Girl Raising Project),https://redd.it/8fkdti
5873,Respect The Second Lapis Lazuline (Magical Girl Raising Project),https://redd.it/86cugk
5874,Respect Mana (Magical Girl Raising Project),https://redd.it/8k8xmy
5875,Respect Mao Pam (Magical Girl Raising Project),https://redd.it/aclz1q
5876,Respect Marika Fukuroi (Magical Girl Raising Project),https://redd.it/7dtycy
5877,Respect Pfle (Magical Girl Raising Project),https://redd.it/7dt1fr
5878,Respect Princess Deluge (Magical Girl Raising Project),https://redd.it/7dte21
5879,Respect Ripple (Magical Girl Raising Project),https://redd.it/7p489f
5880,Respect Snow White (Magical Girl Raising Project),https://redd.it/7drnhm
5881,"Respect Anomander Rake, Wielder of Dragnipur, Mane of Chaos, Knight of High House Dark and Son of Darkness (Malazan Book of the Fallen)",https://redd.it/8ims41
5882,"Respect the Crimson Guard (Inc. Skinner, Cowl, Blues and Iron Bars) (Malazan Book of the Fallen)",https://redd.it/8orf4k
5883,"Respect Hood, Lord of Death (Malazan Book of the Fallen)",https://redd.it/5t5bm8
5884,Respect Karsa Orlong (Malazan Book of the Fallen),https://redd.it/7jp9q9
5885,Respect the K'Chain Che'Malle and Nah'ruk (Malazan Book of the Fallen),https://redd.it/65mv0j
5886,"Respect Tayschrenn, Imperial High Mage of the Malazan Empire. (Malazan Book of the Fallen)",https://redd.it/8hvprh
5887,Respect Miles Hundredlives (Mistborn),https://redd.it/45v62h
5888,Respect Spook (Mistborn),https://redd.it/3aub7n
5889,Respect Vin Venture (Mistborn),https://redd.it/83owqw
5891,Respect Wayne the Kid (Mistborn),https://redd.it/4isotq
5892,Respect His Highness (Mondaiji Tachi),https://redd.it/bhymv5
5893,Respect Kudou Asuka (Mondaiji Tachi),https://redd.it/bg0pc7
5894,"Respect The Saurian Demon King, Kouryuu! (Mondaiji Tachi)",https://redd.it/aviisi
5895,Respect Maxwell! (Mondaiji Tachi),https://redd.it/bzqqwo
5897,Respect Durzo Blint (Night Angel Trilogy),https://redd.it/42w53k
5898,Respect Kylar Stern (Night Angel Trilogy),https://redd.it/44nmuy
5899,Respect Lantano Garuwashi (Night Angel Trilogy),https://redd.it/40ogq7
5900,Respect Alicia Valeyard! (Outrace The Sky),https://redd.it/7k9zgn
5901,Respect Fortissimo Staplegun! (Outrace the Sky),https://redd.it/7kmyk6
